text,label
"how can 30 second ads for mobile games get away with showing content not only absent from the game, but stolen directly from another game in many cases? even if you ignore parts of ads that clearly show game play or other assets from a different game, doesn't showing game play that literally is not present in the game being advertised constitute blatant false advertising?  is there some loophole for free games or something? ",7
"flow is the mental state in which a person is completely absorbed in an activity, resulting in a loss of their sense of space and time. ",5
"girl who i never had sex with claims she's pregnant and i'm the father. update inside. https://www.reddit.com/r/legaladvice/comments/8lc7k7/girl_who_i_never_had_sex_with_claims_shes

she was lying. she was protecting her new ""boyfriend"" who is 24. she said so to her friend who told me then i told her parents. she then confessed to them. she was having sex with the guy when we were fooling around. i've blocked her number and the guy has been arrested.

thank you for giving me good advice. ",2
"by accidentally getting sexual with my dentist, again. i'm a 32 year old woman who can never go back to my new dentist after two visits because i'm an idiot. 

my dentist is a very nice and professional man. our first appointment was going pretty smoothly until he made some innocuous remark about us ""being strangers."" my immediate reply was ""oh, you're not a stranger! you've been inside of my mouth for 20 minutes!"" i did not intend to make a sexual joke. his face turned red and he was clearly embarrassed but he continued on like a true professional and we were probably both relieved when the appointment was over. 

i had my second dentist appointment today. i actually mentally prepared myself to be a model patient who didn't say anything weird, thank you very much. he had been working in my mouth for about 5 minutes when he started to seem really uncomfortable or something. his face was red and he was breathing a little heavier. i was a bit concerned and also confused. like how could i have embarrassed him this time? i had hardly spoken! so he keeps working in there and then i realize what the hell is happening. my dentist was wearing grape flavored gloves. i had been absentmindedly licking his fingers the whole time. 

never going back.

tl;dr  today i fucked up by licking my dentist",4
"is it weird to go to your childhood home and ask for a tour? a couple years ago i traveled 600 or so miles back to my hometown to see some friends and family. my friend and i took a tour of the town, the elementary and middle school i went to, restaurants i ate at that were still there and even drove past my house i grew up in from when i was born and until we moved when i was 13. 

we sat outside parked in front of the house debating whether or not to knock on the door and see if i could look at my old room and other little things i remembered about the house. 

if you're thinking like me the current owners would probably think i'm casing out the place to rob it but i'd be able to give a decent enough of a description of the layout of the house to maybe ""prove"" i lived in it.",7
"my daughter (7) keeps getting touched inappropriately at school, school brushing it off (washington) on a near daily basis, my daughter (age 7) is getting groped by a boy at school.  she says he typically does it when the class is lining up and when the teacher is not looking, or at recess.  so far he has touched her butt, her chest, and proclaimed ""we should have sex.""

we talked with the teacher, who said she would ""keep an eye on things"" to try and eliminate the opportunity for it to occur.  this has not helped.  we escalated to the principal, who was kind but essentially said it was up to my daughter to cause a scene and yell and scream to bring attention to the issue whenever it happens to try and deter it, but my daughter does not want to do this because she finds the situation embarrassing and doesn't want the attention.  not to mention, it's not actually addressing the issue.

the principal said that they ""have a plan in place, but the plan will only work if all parties are on board.""  the read between the lines comment was: ""the boy's parents are not taking the issue seriously.""  the principal immediately knew who the boy was, and in talking with other parents at least one other girl in the class is having a similar issue of unwanted touching.

we are really fed up that the situation is allowed to keep occurring and that our daughter does not feel safe.  it shouldn't be up to my daughter to ""cause a scene"" when it happens.  what obligation (if any) does the school have to try and correct this issue?",2
"when my best mate changed his name in my phone to ""sexy jess from work"" so several years ago my best mate todd changed his name in my phone too ""sexy jess from work"" and then would ring my phone in the middle of the niggt to try and get me in trouble with my partner. but she was friends with him before we had even gotten together so she recognized his number and his prank didnt really  work out.

fast forward 6 or 7 years to the weekend just passed.
im sitting on the couch watching tv and my partner is upstairs my 8 year old daughter is bored so i give her my phone to play a game on.

que fuck up.
i never changed todds name back. its been a running joke between us for years.
so ""sexy jess from work"" calls whilst my daughter has  my phone. she freaks out. comes running into the lounge room crying throws my phone at me and screams ""i hate you dad!"". she runs off upstairs.
so im sitting there really confused. after a few seconds i follow her upstairs. i can hear her crying then i hear my partner start laughing hysterically.
now im really confused. i get to the bedroom. my partner just  holds up my phone showing a missed call from ""sexy jess from work"". i piece together whats happened and spend the next 20 minutes explaining to my daughter and calming her down then call todd back to tell hin how his joke has made it to the next generation.

tldr : buddy saved his name in my phone too ""sexy jess from work"" several years ago as a joke. today my daughter sees it freaks out and thinks im cheating on hwr mother.

sorry for formatting on mobile.


edit. wow this blew up.

so yes my daughter threw my phone at me. then picked it up and took it with her upstairs.

im australian. my daughter is in grade 4 and is quite intelligent. yes she knows what sexy is and yes she knows what cheating is.

sorry for the spelling and lack of grammar, im lazy.",4
"girl: ""come over"" guy: ""i'm coming over""

girl: ""we should stop using walkie talkies in bed, over.""

",0
"my ex (29m) decided to end things by trickle ghosting me (28f), i was starting to heal until i found out the reasons why he ghosted. the past several months have been incredibly draining and hard for me. i'm not sure if i'm looking for advice or just a place to vent. 

my ex, 'tom', and i had been together for about 4 years and we were extremely happy together, or so i thought. we had been discussing the possibility of getting married, and even looking for a house for us to move in to (but we were not living together). i was happy, and i thought he was too. we had a lot in common, never fought, we traveled together, my friends liked him, his friends like me, our families got along together, etc, i could go on. 

everything was fine until our last trip together. we went to a destination where i had always wanted to go, but because of cost and distance it seemed like something i'd have to wait longer to do. it was his idea for us to go here, we saved a lot of money and were able to make this 2 week trip. once we got back from this vacation, things started to get weird. 

after we landed (the last time i saw him) he told me he was feeling unwell and sick from the trip and wanted to go home to sleep. i didn't think this was too unusual so we said our goodbyes. i tried texting and calling him the following day to see if he was feeling better and he didn't respond. i started to worry, but he finally sent me a single text saying he was fine but tired about two and half days after our trip ended. from there our communication basically broke down. i can't say he fully ghosted me, because he would occasionally send me a message, and didn't remove me from any social media. from that point i'd try to contact him by calling, texting, sending a message on facebook and he didn't respond. after about 4-6 days of no communication, he would end up sending me a couple of texts and then i wouldn't hear from him for several more days. what hurt even more was this ghosting period overlapped with new years, valentine's day and my birthday - days on which nothing happened and he didn't even wish me a happy whatever. 

i felt like i was going crazy. i had no idea what was going on and just wanted some sort of answer from him.  i was also extremely embarassed to talk to anyone about what was happening. i stopped going out as much, and didn't really see my friends for the 2+ months he was trickle ghosting me. i found myself lying to my friends and family about his whereabouts - telling them he was busy with work, visiting his family, he was sick, or any excuse i could think of whenever i showed up somewhere without him. 

i eventually broke down, i contacted one of his good friends who i felt comfortable with and asked her to meet up with me. i told her that tom had barely spoken to me in the 2+ months, he's only sent me a few text messages and i have no idea what's going on. i told her i didn't know if he was mad at me, if we were broken up or still together, or if there was something else going on that i needed to know about. she looked kinda shocked and confused and told me that tom had told told all of his friends that we had broken up and i that i was taking it really hard, and out of respect for me not to bring it up if anyone saw me. this was soul crushing to hear and i felt humiliated and worthless. i told her this wasn't the case, and that he never verbally confirmed that we were broken up. she said she was extremely angry at him and would talk to him. 

throughout march and april i felt like i was starting to heal some. i felt broken, but i started to pick up the pieces again and began to feel a bit more whole. i told my friends and family the truth about what happened and they were nothing but supportive and helpful. then i found out some additional information about why he ghosted me and what happened on his end. 

he had apparently been cheating on me for awhile. not sure how long, but a little less than a year. i'm also hurt because i know the person he cheated on me with. she's an absolute garbage person. and i'm not saying that as a jaded ex girlfriend. she has always hung around our group but never really been a part of it. i've heard her say some extremely bigoted things about minorities, the lgbt community and non-christians. she is the type of person who is proud to take advantage of government assistance programs, when she doesn't need it. she somehow was able to claim disability, and has bragged about pulling the wool over the government's eyes. i think she was able to somehow use her obesity problem as her disability, i'm really not sure. i can't really confirm any of this, it could be a lot of talk and bullshit on her end. i've always thought you need to be drug tested in order to get some government benefits, and she does a lot of drugs. not only does she take advantage of programs meant for people who can't help themselves, but she is sent a couple of thousand dollars a month from her rich parents, which she also brags about. her parents have paid for her car and i think they pay her rent too, so the money she gets is spent on pretty much whatever she wants. she spends her days getting drunk at the bars and restaurants my friends and i frequent and will interject herself into our outings. she has also tried to sell us hard drugs in the past and usually mentions that any of us are welcome to her place to get high. 

tom apparently started to get high with her at her place, and was originally just trying to hide his drug use because he knew i wouldn't approve. then he started to get high and then have sex with her. he felt guilty and embarrassed about it, but this wasn't enough for him to stop getting high with her. his intentions were to just get high and then leave to go back to his place, but what would usually happen is they would end up having sex once they were both properly high. this woman hated my guts, and kept pushing tom to break up with me so they could be a couple. he didn't want to end things with me, but felt so guilty and disgusted with himself he thought the best thing to do was to just try to ghost me. 

tom kept their relationship secret for awhile, until she got tired of their secret relationship status. so she just started to blurt things out about them when his friends were all together at their usual bar. he came clean to his friends about it, but was so embarassed that he shortly ended things with her after his secret was found out. 

i only found out about this, because the same friend i had met up with a couple of months ago reached out to warn me that tom is going to try to get back together with me and felt that i deserved to know the truth in case he isn't forward with what happened. 

1. there is no way in hell that i'd get back together with tom
2. i can't help but feel like absolute dog shit that tom would end things with me over that kind of garbage person and i'm having a hard time understanding why he would chose some waste of space, over someone who is actually trying to be a person and is successful. 

i don't know what to do at this point. i'm dreading the possibility of seeing his face again. i don't know if i could contain my urge to slap him, or if i would just break down and sob. i was doing well from moving on from him. i was starting to feel happy again. now, i think i'm back at square 1. i'm depressed and stressed out. 

is there anything i can do? i kind of want to stay hidden in my apartment not answering calls until this is all over.",8
"deepthroating myself in front of my new assistant. the update!!(https://www.reddit.com/r/tifu/comments/c682li/tifu_update_deepthroating_myself_in_front_of_my/)

&#x200b;

ohhhhh where do i begin. this happened this weekend.

let's lay out some plot points first..

\-i'm 37 years old and recently dating a girl for a couple of months. she is 26.

\-i work as a film editor, and often have new assistant editors for different projects. i've recently started on a new project and have a new assistant who is a 27 year old woman.

\-i've always worked out, done yoga, i'm fit and slim, and have an above average sized dick. this combination has given me the unique talent of being able to suck my own dick. i've been doing this for many many years, all of my partners have always found this amusing and arousing. i know there are dangers, yada yada yada, but trust me, i've done it a lot and i know what i'm doing, lol.

&#x200b;

okay. so, the girl i am dating is very fond of this talent, and told her group of friends about it. one of whom is getting married soon. she was doing her bachelor party, and instead of hiring the beefcake stripper, her friends wanted to see me suck my own cock. i was a little put off by the idea at first, doing this for a group of strangers, but the idea was kind of hot, and it's all in good fun, so fuck it, right? i agree to the plan. i was a little nervous about meeting them first, making too much eye contact, etc, so we came up with the best plan to make this happen.

&#x200b;

there are a few methods to doing this, the easiest and um, ""deepest"" of which is to put my legs over my head. this way, i would be looking up, and wouldn't really have to look at any of the girls. but the could see full view of my cock going into mouth. (i can draw a diagram if needed.)

&#x200b;

so the day comes, i have a couple of shots of tequila to loosen up. by the time i arrive the girls are already pretty tipsy and rowdy, chanting things like ""suck your dick!"" from the other room. i prepare myself with the girl i'm dating, and she invites her friends in. they are hooting and hollaring as i'm laying on the ground with a very erect cock. the whole thing is actually pretty hot, and even though my heart is racing like mad, i'm really into this idea now.

&#x200b;

i throw my legs over my head as i've done many time, and start to play along with the ""show""... i circle my tongue around the tip, teasing myself. i put myself further and the head goes in my mouth and i hear the ghasps and woo's and girl noises coming from behind me. i'm trying to look back to see them, but i'm a bit focused on the cock in my mouth and really can't see past my head. i start getting more and more into it, and the girl i'm dating comes over and helps me push it deeper into my mouth by pushing my ass and legs down, as we've done before in our own private world. at this point i'm really into and sucking my cock like a champ. the girls really seem to be enjoying it.

&#x200b;

after a some minutes go by (not sure how long), they start chanting ""cum in your mouth! cum in your mouth!""... now to be clear, i normally don't do this. i have before, lol, but it's not my thing. but i'm the entertainment, and i aim to please, so in my mind i'm thinking lets do this. i start sucking harder, tongue playing with the tip. the girl i'm dating is still pushing me a bit, her hand on my ass. the whole thing is so hot and i feel like i'm about to cum, and.....explode. it was a lot. i'm shaking and convulsing sucking my tip, they are clapping and cheering. the girl i'm dating let's go of my legs and i fall down, sweating, with a mouthful of cum. her friends start to yell -- ""kiss him!"" ""cum swap!"" - i'm actually not sure what they were yelling but it was along those lines. so i stand up, in a daze, and kiss her, she takes the cum from my mouth, and i look finally at the girls all in joy, except one unbelievably shocked and mortified face - you know where this is going of course. my assistant.

&#x200b;

she leaves the room, i race to the bathroom. the girl i'm dating comes in to ask me what is wrong and i tell her. she loses it laughing - ""so and so is your assistant?! ahahahah"". i'm not laughing. assistant isn't laughing and actually leaves the party.

&#x200b;

it's actually a bit of a scene, the girl i'm dating tells her friends, there is laughter, discussion, they are calling assistant and she is not answering. the girl i'm dating assures me they are all like this, this is no big deal.

&#x200b;

i've been working from home all week. i've talked to my assistant via slack and we've said nothing. she is in the office. i can't work from home tomorrow. i don't know what the fuck to do. the girl i'm dating said that assistant is mortified, and doesn't know what to do either. i really don't know what the fuck to do.

&#x200b;

tl:dr - i sucked my own dick at a bachelorette party, at which my new assistant was in attendance. we haven't spoken about it since.

&#x200b;

edit:  the diagram(https://imgur.com/a/rr31ebi)!  i'm a terrible artist, forgive me.  i'm not a turkey, i promise.

edit 2: to clarify, i don't think she was mortified at what she was watching.  i think she was mortified when she realized it was me.  the diagram above is meant to show that they couldn't really see my face until i stood up.  at least this is the logic i am convincing myself of.

edit 3:  i'm being very specific that she is not my girlfriend and ""a girl i am dating"" because honestly i wouldn't do something like this with my girlfriends friends.  i don't think either of us see a future in this relationship, we're just having fun.

edit 4:  yes, they were staring at my butthole.  i'm well groomed, no one seemed to mind. to be honest if,

edit 5:

since everyone is asking, i'll offer my thoughts.  no, i'm not gay or bi, and have never sucked someone elses dick before.  pretty sure being gay or bi involves being attracted to and/or having sexual experiences with people of the same sex.  it's my own dick, so i think that conversation is pretty straight forward.  by your logic, all of you have given thousands and thousands of handjobs and ew, you've touched a dick like 10 times today at least.

as for the ""i've heard it feels more like sucking a dick than getting your dick sucked"" - i bring it back to the above statement.  a handjob obviously doesn't feel the same as jerking off.  kissing your own hand feels different than someone else kissing your hand, etc. etc.  i think maybe the first time its unfamiliar to have your own dick in your mouth, or for those of you ""with a friend who told you"" .. they probably only tried it once or twice.  but it's become a familiar feeling for me, and it feels wonderful.  better than jerking off that's for sure.

and yes, i have and do occassionally do this instead of masturbating.

thanks for coming to my ted talk.",4
"almost everyone who is 'good with money' shares a common trait: they make a detailed budget for the next month and stick to it. if you've never done so, tomorrow (the 31st) is a perfect day to start. ",9
"not sure how to deal with my 37f anti-vaxx husband 35m since i want to get our kids vaccinated at first i assumed he would come around and realize it's the right thing to do.  we were both vaccinated as children, as were both of our families.

it's been 6 years. six years since our daughter was born, and 3 1/2 years since our son was born. 

first, he said he wanted to wait until they were older, maybe 1 year, to ""let them develop before we add chemicals.""

at 1 year i pushed to vaccinate but was met with his ""uncertainty."" 

today my daughter had a fever of 102.3, over 101.6 for more than 24 hours, and i decided to take her to the er.  

thankfully she doesn't have anything serious, but for more than 10 minutes the doctor laid into me about how important vaccines are for our children. 

he said all the things i've said to my husband, and more, and made me feel like shit. he explained that a 4 month old baby was hospitalized 3 days ago for meningitis, and lived even though he didn't expect him to survive.

i tried to explain that i agree, but i feel he didn't believe me that it was my husband's wishes i was respecting up until now.

he ended by saying, ""look, *my children are vaccinated.* ""

on the discharge paperwork it says: ""vaccination not carried out because of caregiver refusal"" under the diagnosis.

i look stupid because of my husband's ignorance.

i won't do this anymore. although he is a sweet man with a kind heart, he is endangering our children.

can i just take them myself?  we always go together....thus he's always there and freaks out if vaccines are mentioned so the doctor gives up.

what can i say so he won't go? how can i keep this form him, or should i tell him once it's done?

reddit i need encouragement and suggestions what to do. 

please help

edit: for the people who are down voting::

if i was in some kind of religious cult and asked for help to get out you would help me. help me help my children this is no different. for those of you that have always agreed with your spouse on this, you are lucky. i thought he would eventually let them get vaccines but now it's just excuse after excuse.",8
why will the congress never impeach trump? because the republicans always insist on carrying a baby to full term.,0
"boyfriend (21m) kisses me when i'm asleep lol should i tell him i know? so i've been with my boyfriend for 2 years and i found this out pretty early on. he does cute stuff when he thinks i'm asleep. i'm a deep sleeper so i never woke up from it. i couldn't asleep one night and i knew he was walking past me and he blew me a kiss and just said ""love ya bitch"" while he was walking lol. i didn't know what to say because we hadn't said i love you or anything at that point so i just continued to pretend to be asleep. he actually does it all the time!! sometimes he'll give me a kiss on my cheek or arm, or he'll say ""love you babe"". he is so sweet when i'm asleep!! he's not really affectionate like that when i'm awake, he kisses me but he doesn't randomly call me cute or something. and when i'm asleep, he can say ""did you know you're so cute"" like what!!!!???? sometimes i pretend to be asleep because i like hearing it. and he'll tell his friends that he's not a pussy and he's so tough and everything and i'm like ðŸ™„ðŸ™„ you literally come to me when i'm sleeping and tell me good night in this sweet voice. i never say anything though 

when he's sitting down doing something random, i just have the strongest urge to go up to him and give him a kiss and be like ""you're cute babe"" and maybe he'll realize that i know. or should i just continue pretending i have no idea???",8
"there should be a separate olympics where players can take as many drugs as they want it would be cool to see what the true limits of human strength and endurance are, and probably reduce drug abuse in the regular olympics because players who want to do that would mostly transfer into the unrestricted event. 

tbh i see nothing but upsides.",6
