text,label
"my wife (f30) told me that she cheated on me (m28) and i honestly don't know what to do we have been married for over 5 and a half years. i love her so much. we finally got our own place on december 2018 and things were looking up for us. these 5 years were so magical and i always told myself that through all of our trials in life, that i would marry her again.

this past tuesday, my lead told us that we can vto  (volunteer time off. i work night shift) so my co worker gave me a ride home. (my wife and i share a car). when he dropped me off, i noticed that our car wasn't parked in our parking spot. i thought that she parked somewhere else.

as soon as i went inside, i went to our bedroom so that i can kiss her and surprise her and let her know that i am home. the plan was to make her breakfast before she woke up to go to work.

she wasn't in the room. she wasn't home. so i called her and asked her where she was. when she answered, she sound like she just woke up.

my heart broke because i had a feeling of what was going on. she made an excuse that she was at the store to get balloons for co-worker's birthday. i gave her the benefit of the doubt.

so i was in bed and she finally got home after 30 minutes of waiting. she sat on the bed and i asked her if she was okay. she wouldn't answer and began to cry. then after 5 minutes of asking of what's going on, she told me that she cheated on me. she said that she went out and talked to someone, got drunk and it just happened.

i am sad. i honestly thought this would never happen to me. i don't know what to do. we had a long talk about our marriage and what we would do. we agreed that we would try to work it out, but at this time, 9/6 at 0545, i am strongly considering in divorcing her. i can't even look at her anymore. the thought of hugging her, kissing her, touching her makes me sick to my stomach. she wants to work it out, but my heart isn't in it anymore.

what should i do? am i overreacting?  i honestly thought of killing myself. i am so sad. she was my everything.

tldr;   wife confessed to cheating. i am so sad. thinking of killing myself.  what do i do?

&#x200b;

thank you

&#x200b;

edit to say: just got back from my long ass walk since posting this (0500 pst) i am so surprised for the support! <3

thanks to all that replied to me with your advice. i still love her and ultimately, even though it is tough for me,  i forgive her. time will heal this pain and honestly, i love her too much to end this.  we have been through so much and have so many wonderful memories. i honestly can't imagine being with another person.  she is truly sorry that she cheated on me. most wont agree with this, but i will give her another chance and see where this goes.

and no, i wont kill myself. i promise.  i really appreciate your concerns and replies. it makes me happy that you all took time out of your busy lives to reply to me. take care everyone and i'll update as time goes on.. <3

&#x200b;

\*\*\*update 09/13:\*\*\*

i have been reading the comments. i understand that to most it is stupid that i am still with her. i understand. trust me. we have been talking a lot. she is truly sorry and i forgive her. i put her mistake behind me and i am looking forward in fixing our marriage.  we plan on going to therapy soon so that we can talk it out. the reason why we haven't gone yet is because we have to work because there are bills that we are paying off (we will be debt free by the end of 2019.) but we will go sometimes next week.

&#x200b;

we are working this out. we are still living together. we are communicating more and more about what we need to do to improve our marriage and love life. honestly, it has been going well. things are looking up because soon, i will be transferring to day shift so that i can spend time with her, sleep with her and have the normal schedule that i have been longing for. i still want her in my life and i don't see divorce. we will work this out.

again, thank you all for helping me in my time of need. i am really grateful that you all took the time in giving me advice. it helps. ill update as time goes on. <3",8
"telling teenagers that their relationship is pointless, stupid, or doesn't matter, is just rude and stupid. most teenagers these days understand they aren't gonna be together forever and get married and shit. if they ask for advice and you tell them it doesn't matter because they're young you're a prick. they deserve to be happy and they don't doing anything harmfull.

edit: i did not expect this to blow up so much, thank you kind stranger for the gold!

edit 2: i know my original explanation is somewhat short so i'd like to clarify, teens need experience in order to have healthy relationships later in life. it's an important part of growing up.",6
"neighbor's ""kid"" won't move his car from taking up the two spaces in front of our home. after asking politely to move it, family retaliated by moving all their cars to the road taking up all the space adjacent to our home. california here, getting that out of the way. and full disclosure, its not my home. the home belongs to my parents, but i house sit for weeks or months at a time for them and deal with the neighbors enough to care(plus i love my parents and want what's best for them). i will just be saying my home or my driveway so i dont have to keep typing ""my parent's driveway"" or ""my parent's home"" over and over.


these neighbors moved in a year or two ago and have made life so uncomfortable for my parents they are actually talking about selling their home to move, their marriage home with all the memories. i thought they were selling because they wanted to move out of state, but have since found out it is because of them.

my parent's neighbor's kid (a very immature 20 year old) has a beater he leaves parked in front of my parent's front yard. he has it parked in the middle so that it takes up all the space and no one can park on either side of it without blocking a driveway. it has been in 3 wrecks in the past year and currently he wont drive it. why? i don't know. perhaps it isn't in running condition any more. all i know is it hasn't been driven in over a month.... well, until what happens next.

i want to also mention they have a full garage. they also have the same size space in front of their yard to park in, which happens to always be empty unless they have company. and a driveway that can fit and does fit 3 of their cars, including another beater that has never left the driveway since they moved in.

i politely asked him to move his car when i saw him several weeks ago and he flipped out on my, cursing and screaming at me. he followed me to my car and was yelling at my car door window to the point it had fog from his breath. several days later i visited my parents and he had his friends parking in front of his car so as to block my our driveway partially while still leaving the spaces empty behind his car that would block his own driveway and all the spaces in front of his yard were empty to.

i spoke with my parents and they said the kid had his friends doing that ever since i had asked him to move his car as payback. they said he's really mean and to just let it go. this did not sit right to me, so i later after visiting went to the neighbor's home to speak to the parents. i explained the situation and asked they speak with the boy about moving the car and his behavior towards me with the disrespect and language. 

bad idea. i assumed they were decent normal people and this was just an out of control teen. i assumed mom would just tell 'billy, go move your damn car' or something and it would be taken care of. turns out he got it from mom and dad. i get the dad yelling at me to fuck off and get off his property as the mom (from another room) starts bellowing about how i did not just tell her how to parent and he can do whatever he wants and fuck me and my parents. 

i didn't know this at that time, but have since found out my parents believe the neighbors keyed their car about 6 months ago. my mom asked the neighbor mom and son to not smoke at the edge of their driveway, as its right next to my parent's bedroom window and they would be awakened by them talking while smoking in the middle of the night. apparently that set them off and they would talk extra loud while smoking and would hold up a phone playing music to their window as an fu to my mom and dad. that's also when their car got keyed

so since i made the mistake of talking to neighbor parents, it has upgraded from just the kid's one car and his friends when they come over. now the parents are retaliating too.they finally moved the beater, but only to move their cars from the driveway to taking up the two spaces in front of our yard adjacent to their driveway. the one car parked just enough to have the front poking into our driveway. the beater was moved so its parked on the other side of our driveway in front of our other neighbor's yard but also sticking out enough to just be in the way of our driveway too. sorry for the run-on sentence. did that all make sense? i hope so.

this has been going on for a few weeks now.

is there anything that can be done? my parent's just seem to want to let it go. not only do they say the street parking is technically public parking and they can't officially complain about it, but they complain the neighbors will only retaliate worse. my parents travel a lot and my work makes it so i cant always be there to sit the house for them. they fear the neighbors will do something to their property when they are gone. i used to think they were over reactionary and the neighbor's kid was just rude, but this isn't right. is there something that can be done to get them to move their vehicles and/or protect my parents so they dont feel forced to move?


tldr - neighbors parked all their cars in front of my parents home and wont move them, only rearrange them. the neighbors go out of their way to be jerks to my parents. parents fear retaliation.",2
"right now no country ""owns"" antarctica. how are crimes tried or processed there, and is there anything stopping some dumb dude going down there and saying ""okay, i live here now""? ",7
"by trusting some rando on airbnb shit river 2k19

we have a thousand words to explain all that transpired with our dear friend paul from august 3rd to august 4th, 2019. let me spin you a tale...a tale of shit river.

4:30 pm

our initial impressions of the house were terrific! our illustrious host, paul, left a bottle of red for us on the table along with some chocolates and popcorn. paul was friendly! check-in was quick and easy so our party settled in. everything was looking great!

6:00 pm

we return from purchasing perishables for the weekend. we fill the fridge as we prepare for a relaxing and restorative vacation. we had all traveled far and been looking forward to this rare reunion! a few days on the beach does wonderful things for the soul, but little did we know how our souls would be blackened forevermore.

8:15 pm

after a round or five of drinks, we noticed that several members of the party had disappeared and were nowhere to be found. we discovered them, ominous plunger in hand, staring terrified at a slowly rising toilet (one of two in the house). plunging half successfully, we messaged paul and let him know the situation. only one working toilet isn't ideal for a group of 8 twenty-somethings drunk on beer and full of tacos, but we'd make it work!

8:38 pm

the remaining toilet won't flush. the party grows worried. paul assures us that he will call a plumber.

9:00 pm

paul has no luck with his usual plumber; they won't be able to fix the toilets until the next morning. a five second google search reveals there are twelve (12!) emergency, 24 hour plumbers in virginia beach, but paul did not want to call them. after ""informing"" our dear friend paul of our displeasure, he put his nose to the grindstone and made a few calls. a plumber was found! magic!

9:30 pm

raw sewage floods the shower and both toilets. kitchen sink makes a strange noise when turned on. the house likely possessed. drinks have been drunk like it's the end of prohibition and we cannot drive or uber to safety. after all, where would we go? we pray to whatever eldritch creature haunts our plumbing to spare us.

10:01 pm

the stench. dear god. the stench.

11:20 pm

emergency plumber arrives with paul and paul's friend in tow. one of them goes to the roof. one of them pounds a pabst blue ribbon. advance guard sobered up and makes an emergency run to a public bathroom. we split the party.

12:20 am

plumber ventures inside the splash zone to duct tape garbage bags around the toilets to seal them in preparation for ""the final blasting."" paul's friend fails to discover how to ""switch off his nose"" and taps out (""i'm out man, i'm out.""). it's been hours since most of us have relieved ourselves. the backyard beckons us with its soothing siren call, but we resist. *for now.*

12:22 am

paul assures us the problem will soon be fixed and to keep partying. classic paul! we oblige, blithely unaware of the horror shit show still awaiting us.

12:24 am

the final blasting. the stench. the horror. the splatter. we all take 2d6 damage.

1:00 am

paul & co. tell us the bathrooms are fixed but not to flush toilet paper. he requests we instead put used toilet paper in conveniently provided (bagless) trash cans. we decide to maximize our fun and minimize our bathroom usage. we also decide to leave the next morning.

2:00 am: the witching hour

lights flicker ominously. the house isn't finished with us yetâ€¦

4:30 am

paul offers a full refund (excellent). he later tries to convince us to stay and only refund the first night (not excellent). we ask for a full refund and promise to evacuate in the morning. he offers to let us stay for free for the remainder of our reservation (excellent?) but we decline and agree to leave by noon (clairvoyant).

10:30 am

the party prepares to leave after a night of sheer terror. we take trash to trash cans, clean the kitchen, and prepare a sacrifice to the toilet gods.

11:10 am

we commence the cleansing ritual in the kitchen. after completion, we agree never to speak of this again. who would believe our onerous, nay odorous, experience?

11:11 am

the great gurgle. we hear, deep from the bowels of hell, a cursed glugging. was it the broken spirit of paul's friend chugging another pbr? nope. the shower had once again started flooding with raw sewage.

11:15 am

we hasten our efforts to flee. paul is called. we finish packing all but the final suitcases into our cars.

11:30 am

we convene to discuss departure. suddenly, one of our party realizes we've been cut off from the last of our supplies by a seeping shit river pooling in the hallway. fearing the end is nigh, a brave hero bounds forth, vaulting across the rising flood waters of the rubicon. we form a fire line to ferry our belongings and our wounded to safety.

11:32 am

water oozes up from the baseboards. satan's septic tank thirsts for blood. the lights flicker once more.

11: 35 am

our dearest friend paul arrives, eloquently prophesying: ""this house is fucked."" agreeing with paul's uncanny observation, we flee the house. the smell stayed with us for days but the memories will haunt us forever.

tl;dr i trusted my airbnb to have functional plumbing but instead it exploded.",4
"""hey dad why is my sister called teresa ?"" ""because your mum loves easter and it's an anagram of easter !""

""thanks dad !""

""no problem alan""",0
what would happen if facebook shut down and all its 1.2 billion users moved to reddit? ,1
"during the time of the great depression, a banker convinced struggling families in quincy, florida to buy coca-cola shares which traded at $19. later, the town became the single richest town per capita in the us with at least 67 millionaires. ",5
"as a manager, give praise in public and give discipline in private. in an old job in ""corporate america"" i had a manager who would always share with employees encouragement and kind words of praise within earshot of other employees, and would offer words of critisicm and suggestions for improvement in private (in his office or a conference room). this set up an environment of positive reinforcement and gave employees respect and honesty they needed to perform at a higher level.


edit: good call by /u/slumdawg11b for pointing out that this applies to any leadership role, and /u/airforcefalco that it applies to parenting. 


edit 2: lots of folks rightfully expressing that this is a catch-all method and knowing your employees' personally to effectively give praise and discipline is the best way to go.",9
"i 26m upset a woman 20sf and my friends are acting like i'm in the wrong. hey guys.

i went out clubbing last night with my friends. there were seven of us, three guys including me and four girls. my girlfriend hannah was meant to come too but she was feeling ill. i offered to stay in with her but she insisted i go out and have a good time. 

at the club my friends got talking to a group of women who apparently work in finance. they were here for some kind of conference and were checking out the local places in their spare time. 

one of them, lauren, started trying to chat to me and ask for my number. she was pretty but i was not interested as i have a girlfriend. i told her this but she then started asking for pics of hannah. i showed her and she said that i ''could do better than that''. i was very annoyed and told her to leave me alone. 

later me and my friends were dancing, and lauren and her group came up to us and she started trying to dance with me. i gave her the brushoff once again and moved away from her and she gave me a dirty look. a while later she came back and by that point was very drunk. she smirked at me and threw her drink in my face. i was absolutely fuming and in response i poured my beer on her head. she started crying and ran to the bouncer who got us all kicked out. 

everyone then proceeded to have a go at me. i understand they were annoyed that we were kicked out, but everyone was acting like i was wrong to pour my drink on her. they all saw her splash her drink in my face, but everyone was saying it was nasty to do that to a girl. 

the ladies in our group were talking about how upset they'd be if someone ruined their dress/hair/makeup by doing that, but when i pointed out she did the same to me everyone said that it isn't the same. 

nobody said goodbye to me last night and i made my own way home. i told hannah what happened and she agrees that i didn't do anything wrong. i tried explaining myself again over the groupchat but everybody ignored me. 

how do i sort this out in a mature way?

tl;dr: my friends are acting like i was in the wrong for pouring my drink on someone who threw hers in my face.",8
"for not helping my son and his wife with my grandson? necessary information: when my oldest son was 16 he got his girlfriend pregnant. after a lot of trouble they made all kinds of promisses and decided they would care for the baby, this led to the girl getting kicked out by her parents and she came to live with us. except that when the baby was born, the girl broke up with my son and went back to her parent's house leaving the baby with us.

that was when my husband and i stepped up to help him raise our granddaughter while our son finished his studies and got a job to provide for her. when she was 1 year old he put her on daycare because my husband and i still worked and there was only so much we could do at that point. once he finished college he rented a place to live with her, the help we provided after that was when he needed to go somewhere and couldn't take her with him or when one of them got sick.

&#x200b;

now, the issue at hand is not with him, it's with his younger brother. he's 35 and married, he and his wife had my grandson last year, he's 10 months now. my daughter-in-law wants to go back to working and while she can do her work from home, she prefers to work outside. since i'm retired, my son asked me to take care of my grandson while they work. i asked him for how long he needed me to do it, to which my son replied that they didn't had a plan for it. i asked if they had considered daycare and he said that neither he or his wife were comfortable with it. i also suggested they asked his wife's parents and he said that they didn't had time for it.

&#x200b;

he thought of asking me because i had helped his brother all those years ago and it would ""basically be the same thing"". i told him that no, it was not. i was 42 then and i'm 59 now, i didn't had the health issues that i do nowadays like back pain and arthritis. also, he was a married man with a wife by his side, not a 16 year old with a baby.  i would be willing to help them for a short period of time but it seems like they have no plans beyond leaving the baby with me. now he thinks i'm playing favorites and that i'm pressuring him and his wife to comply with my demands but i think i'm just being reasonable.

&#x200b;

edit: while it is nice to know that i'm not the asshole, my son has found the post and is now very mad at me for ""shaming him and his wife on the internet"". i disagree as it was not my intent and i never disclosed any information that could be used to identify them both. he's also very mad about being called an asshole. while he is my son, i find that he needs a wake up call since my conversation with him in private about the issue only made him behave like a spoiled child and his reaction to me looking for input as an anonymous person was to call and yell at me on the phone. i'll let this post stay up and let this be a lesson to him.",3
"serious my (35m) girlfriend (24f) wants me to act like a horse when we have sex, and i'm not into it at all. so, tiny bit of backstory, my girlfriend of 6 months loves horses, has all her life. an additional, seemingly relevant point is, during sex, she sometimes says stuff like 'f*** me with that horse cock'. i've never thought much of it, i thought that was just a way of her saying it's big. but she's started to take it further and it's turned into a bit of a fetish that i'm not entirely comfortable with. a few days ago, she told me she wanted to roleplay, and at first i was pretty on board, but then she said as horses. i laughed, thinking it was a joke and she took it the wrong way, and said she was tired and then went to sleep. i said fuck it and, trying to make her feel better, said i'd do it the following day. honestly it was okay but very, very weird, she got so into it and said it was the best she ever had, and next time wanted to buy costumes, and maybe do it on some hay. i told her no, and i didn't want to do it again and she's back to being mad at me. am i being a dick here? i don't know what to do. sorry if wrong sub, just wanted a second opinion",8
"you get to have sex with the woman/man of your dreams. however, there is press conference after discussing your performance. do you do it, why or why not? ",1
