title,text,label
Alcohol is an absolutely terrible drug and should not be glorified in society.,"Seriously, what other drug can you DIE from withdrawal? How often do you hear the latest car crash due to alcohol intoxication? It's a mind altering substance that frequently makes people aggressive, unaware (Which people use to get others very drunk just to use as a grounds of rape), uncoordinated, ect.

Even if I also enjoy a beer or two once in a while, and I don't shame people for enjoying what they enjoy. You do you.

But the fact that society as a whole is constantly shoving it into media, advertising, and stores without recognizing the very real dangers of it is bewildering to me.

Edit: Wow! This blew up, thanks for my first silvers!

Edit 2: Sorry for not being aware of the lethal withdrawal of benzo's I will keep that in mind, thanks guys!

Edit 3: Thanks for the gold kind stranger <3",unpopularopinion
"My brother died in a power line accident, did it hurt?","My brother died in a work accident. His drilling rig hit a 12,250-volt overhead power line.

Anyway, would it hurt to die that way? 

He was working the controls, standing on the back of the truck when the arm of the drill hit the power line. Witnesses saw the truck burst in flames, and the fire department wasn't able to make it to the truck for over an hour. 

I wanted to know if it was instant? Would it hurt? Did he burn alive? 

I told my mom that it was instantaneous and he didn't even know what happened, but reading online I don't know if that's true. 

I'm crying right now, it just sucks and I miss him terribly. 

Edit: For those asking, this accident happened last May. The emotions are raw and fresh again because Easter is coming up and we had all made plans to go to the mountains, last year during that time.

I had cancelled the plans last minute and a few days later the accident happened.

With it coming up again, I just keep thinking why did I cancel? We could have had one last day with him but we didn't. I want to go up this year, in his memory but I don't know if I can. 

Edit 2: Thank you everyone for the kind words and thoughts and answers. 

I didn't think I'd get this many responses, I honestly just randomly wrote this question trying to help myself with the new grief and pain I was feeling in the moment. 

Truly, thank you everyone for taking the time to answer and respond.

My little brother's name is Joseph. He was 24 years old, and I think of him every single day. ",NoStupidQuestions
What is this one sexual fact everyone would benefit knowing?,,AskReddit
Update: Neighbor touched my son,"  

Original Post here:

[https://www.reddit.com/r/legaladvice/comments/bwkgcw/neighbor\_touched\_my\_son\_nj/](https://www.reddit.com/r/legaladvice/comments/bwkgcw/neighbor_touched_my_son_nj/)

I know the original post didn't get a lot of attention and there probably isn't much demand for an update, but I did want to thank the people who commented and maybe give some guidance on expectations for anybody who might have the horrible luck to fall into a similar situation. Also it's just not something we want to talk about with friends/family…. So call it therapy for me.

&#x200B;

\*\*\*\*\*\*\*

TLDR for the 1st post: Last Monday, soon after I left for night school, my son (5) reported to my wife that our (deaf & mute) neighbor touched his private parts.

\*\*\*\*\*\*\*

&#x200B;

Update: On Tuesday morning the entire family went to the police station to file a report. My wife and I interviewed with an officer and detective together at 1st and then my wife alone. After that the detective contacted the county prosecutor's office.

An hour or so later we were on our way to a county facility, so we could all be interviewed by a couple of detectives from the county prosecutor's office. Once interviews were over the county detectives sat down with my wife and I to let us know my son had given them some actionable information and they intended to act relatively quickly. The detective who interviewed the children had tears in her eyes. 

From there we went home.

That afternoon, Neighbor knocked on the door, looking to play with the kids. I opened the inner door (left the storm door closed) and made it clear he needed to go away, which he did. Soon after I went to night school, asking my wife to stay in doors with the kids for the night, which she did. When I got home, she said nothing else had occurred.

For the most part, Wednesday was quiet and relatively normal. We did not see Neighbor all day. Wednesday night, we came to know why. A detective called to let us know Neighbor had been taken into custody on Tuesday night (while I was at school) and would remain in custody for a few days until his hearing (I assume arraignment).

Thursday morning a woman from the state DCF/CP&P office came to the house. She made a cursory check of the house and interviewed my wife & I together. To my mind, this was actually a good thing.  She was able to let us know that Neighbor had been charged with 2 counts (I don't recall exactly what they are). She also provided 2 other important facts:

1 – Neighbor had a history, albeit old (late 80s, early 90s) and in California.

2 – Neighbor had admitted the act to the detective that arrested him on Tuesday evening.

From there, she advised we were entitled to have my son evaluated by a state specialist and possibly therapy if necessary. We will need to have them check in with us once a month until the case is closed on their end, and the evaluation etc. will necessarily extend that time frame, but we opted to go this route anyway.

While she was there I asked if she knew what the likely penalty was (she did not), and whether or not she thought we should pursue a restraining order, if Neighbor was likely to be free again soon. She was unsure and promised to check in with the detectives on the subject.

Friday (yesterday) afternoon, we received a call from the county detective. She informed us that Neighbor's hearing was set for Monday and that his lawyer intended to ask that he be released to his home, with an ankle monitor, for the period between the hearing and his trial. She wanted to ask for our input as to how hard the prosecutor should push to have Neighbor remain in custody.

Here's the thing. Neighbor, so far as we can tell, actually lives with a family… and they have small children. I advised the detective that we were ok with Neighbor being 'home', so long as he was confined to (approximately) his property. She confirmed that would be the case, and that a 'no contact' order would be in place. We agreed that was ok with us, but also said we felt strongly the family with whom Neighbor lives should have input.

That brings us up to date and, to be honest, I am torn. I HATE what this man did. I hate that it has happened before, and I never want it to happen again. With that said, at first I was unsure as to whether or not Neighbor even knew what he did. He clearly has some emotional/intellectual challenges. But he also knew, at least to some extent, what he was doing…. As he admitted the act to the arresting detective. I get the feeling he is something akin to a deaf/mute Lennie from Of Mice & Men, and that tears my heart out. I don't think he really understands, and I don't want to be vindictive to someone like that. At the same time, he touched my son. If there were no clear impairment, I would want to take a baseball bat to his head. But there is, and instead I just feel like shit for everyone involved. This sucks, full stop.

On a more selfish note, the Megan's law registry. There are a handful of homes for sale in the area. Until now, my wife and I were hopeful that more families with children would move into the area. That hope is now over. Because Neighbor's history all predates Mega's Law, he was not on the registry. Now he will be, and no families with kids will move into the area. I realize this is tangential to the main topic, and pretty self-centered, but it's just one more way that Neighbor is going to make our lives a smidge worse, just by existing. To repeat myself, this sucks, full stop.

Sorry for the book, and if the Mods see fit to remove the update… as it's not all that particular to legal matters, I understand. Honestly, I just feel a bit better getting it all down and putting it out there.

Thanks to anyone who reads through.",legaladvice
I'm (25M) intimidated by a (32F) woman I met,"So Friday night a friend invited me to a party at a very nice house. When I got there I met a woman and we hit it off really well, she was laughing at all my shitty jokes which just fuels my confidence. We were also very close and touchy throughout the night, and when the party ended we exchanged numbers. On the Uber ride home my friend was explaining to me that I was basically getting close with the owner of the really nice house, he's telling me how's she's some high level investment banker and how she's worth millions of dollars. As soon as I heard this I felt deflated, career wise this girl is leagues ahead of me. She's well educated and independent. I work as a service tech for hvac with no college education making pennies compared to her. I texted her this morning and she immediately says how much fun she had Friday night and how she wants to hangout again. I'm scared to respond, because now I feel like I have to act like I even deserve to be in her presence. What should I do to make these feelings go away?

Edit: Hey everyone! I'd like to thank you for all the awesome responses and words of advice and encouragement, Spent over an hour reading all the comments. Me and her texted and set up a date! The first date is Wednesday night, 
hopefully she continues to laugh at my shit jokes LOL. I'll post some updates later to let you guys know how it went",relationship_advice
"TIL While rendering Toy Story, Pixar named each and every rendering server after an animal. When a server completed rendering a frame, it would play the sound of the animal, so their server farm will sound like an actual farm.",,todayilearned
"TIL that in 1982, the comic strip The Far Side jokingly referred to the set of spikes on a Stegosaurus's tail as a ""thagomizer"". A paleontologist who read the comic realized there wasn't any official name for the spikes and began using the new word; Thagomizer is now the generally accepted term.",,todayilearned
AITA for making my boyfriend believe our cat ran away?,"We are both 24 and have lived together for 2 years in my apartment. For my birthday last year and he got me a cat for us to share which he named Lucy. I thought it was a cute name and I took care of her so well and love her very much. Last week we were having sex and he moans out Lucy's name. I ask him why he is moaning our cats name and he says it was just an accident. I ask some of his friends if he knows anyone names Lucy and discover that is a coworker of his that I didn't know he had. I talk to her and find out they have been cheating for the whole time we've had the cat. He literally got me a cat and named it after her so he would have an alibi if he accidentally said her name. I told her that he was my boyfriend and she didn't believe me so I showed her some pictures of us together and she started crying saying that she didn't know he was dating anyone. I told her that I was sorry and that it wasn't her fault but I'm glad we found this out. I kick my boyfriend out for cheating and he moves in with his brother. He tries to take the cat that he gave me. I don't feel that he should get the pet since he didn't buy it out of love but only as a cover for his cheating and I've been the one taking Lucy to all her vet checkups and buying all her food and toys and everything. I convinced him that the cat ran away and he's upset with me for that but I don't really care because I'm done with him and I don't feel he deserves to keep the cat that he gave me and never really took care of. AITA?

Edit: I'll try and answer the most common questions. 
- I don't think he planned to moan the cats name during sex, he has called me Lucy before in casual conversation and I didn't think anything of it because of the cat. 
- I did try to tell him the cat was a gift but he started spamming me with messages and since he knows where I live and work I didn't want him to start stalking me since he was showing signs of that. Once I told him the cat ran away he got mad and now doesn't want to talk to me anymore since it's my fault I lost the cat. So now I can just take care of my cat without worrying about him showing up unannounced 
- yes I am renaming the cat, one of the comments suggested Lucky and that will be her new name. :-)",AmItheAsshole
AITA for forcing a 6 year old kid to be separated from her parent on a flight?,"Title kinda sounds fucked up but hear me out lol

I recently was on an international flight and I always try to snag the window seat so I can sleep. A woman was seated next to me and asked if I could give up my seat since it turned out that her 6 year old was apparently seated in the row across. I tried to be nice about it and said, ""Sorry, but I specifically chose this seat and I don't really want to give it up, I've been traveling for hours.""

The woman's response was, ""Well so have we! Imagine traveling with an overtired kindergartener who now won't be able to sleep since she can't sit by her mom!"" She made me look like an asshole in front of the other people on the flight, and I felt bad since it was a little kid. I agree that it probably sucks to be traveling with a little kid, but AITA for not giving up my seat?

EDIT:

1. I was seated in the window seat, the woman was in the middle seat next to me, and another passenger was in the aisle seat next to her. 6 year old kid was across in the next row over in the aisle seat. Since the mother and the kid were only one seat away from each other, it wasn't so much an issue of not being seated next to each other, but more that the mom wanted her kid to have the window seat so she could sleep
2. This wasn't an issue of separation and the kid being scared. Her mom was ONE seat away. This was an issue of wanting the seat for her kid just so she could sleep
3. For those asking duration of the flight: 6 hours
4. For those asking ""Why didn't she ask the other person in the aisle seat?"" Because she specifically wanted the window seat for her child",AmItheAsshole
How can I hide my depression from my dog?,"This sounds so stupid.. but whatever, here we are. 

I am very depressed. I cry most days, I go to work and come home and don't really do much but stare at my wall, don't have any friends etc. 

I play with my dog a lot, take her on long walks, and take care of her because she doesn't need to suffer just because I do. But I can tell it makes her sad when I'm sad. She whimpers and tries to climb all over me and lick my face until I stop crying. I've tried to just smile a lot and use sweet voices to her but I can literally tell she is not buying it. She just ignores the toys I throw for her and treats and tries to comfort me instead. 

Is there something I can do to trick her? 

Edit: Thank you to all of you. You're all really supportive, understanding, and sweet human beings. I really appreciate it. Apparently you can't trick your dog so I'm just gonna try and do my best to get better for her. ",NoStupidQuestions
"My girlfriend who I am living with told me I'm not good enough for her...... ""but""","So this kind of discussion has been popping up here and there for the entire year that we have been together.  We have a lot of fun together and most of the time it is great in every way. I'm 31 and she 29, not married.

We were having a general (or so I thought) conversation about relationships and what people in mixed-culture couples want and ask from each other, as well as differences between men and women.  Then she told me this:

&#x200B;

*""You are not good enough for me, but you are the best I could find. But I love you""*

&#x200B;

A little more background: I'm north european and she is from central asia which means we have some cultural differences to overcome. We have been living together in my apartement for most of the time that we have been together. I work and make decent money in engineering and she makes twice of what I make.

&#x200B;

She wants me to get a better job so that I make as much as she does, or almost, or more. What bothers me is that she wants me to make money so that I will be able to provide her with money to pursue her hobby in fashion and buy her dresses and the jewelry she want, when she for some reason gets unemployed. She believe it is natural for the man to pay for everything in the relationship (including house, food, car, expenses etc) while she spends her money on herself, and then contributes whatever she feels like, even when working and making twice what I make. For me the natural thing is to share expenses, and contribute more or less equally since we are a couple and live together. This is very hard for her to understand. From my point of view she seems entitled to special treatment.

There are more issues...  she told me that she told her ex that he had a small dick, she called her other ex worthless when he was depressed. So I basically worry she will treat me the same way if I won't be her little dog. That's the feeling I get.

What is going on here? I'm just trying to understand...or rather figure out if it is worth staying. Thanks people.

&#x200B;

UPDATE:  Thanks for all the comments. First reddit post so this is very cool.This post was all about the bad, crucial stuff and the stuff she would start a silent and stubborn tantrum about.The good things in this relationship is that she seems very caring and attached to me, tries to understand all these differences in culture. She is very honest and we have a great time on a day-to-day basis, laughing, fooling around, sex and more.

I just can't get my head around her expectations. Is it just ""cultural differences"" that I can accommodate to some degree or is it her deep character...One of you said this about her thinking:   "" your money is 'our' money and her money is her money"" ( [FirstFarmOnTheLeft](https://www.reddit.com/user/FirstFarmOnTheLeft) ) ....which is spot on. That mindset bothers me a lot.

CLARIFICATION: She IS paying half the expenses for the apartement, but reluctantly.",relationship_advice
TIFU by stumbling across my mom's affair...,"(I started writing this when the whole situation first happened, but it started to get more and more complex, so I've been waiting to get as much info as possible, and it's been about two months since the first incident.)So here's some background information, my parents have been together 19 years. My dad's the real provider for the family, he was in the military for 26 years, but retired after being hurt in a car accident. He still makes good money off his new job and Veteran's Affairs checks. My mom spends a lot of his money on clothing and purses and other stuff, but it's kind of okay because she's a stay at home mom. The one thing I was always upset about her was that she traveled a lot, never taking any of my family with her. Me(16M), and my two little brothers(11) never have traveled anywhere with her. With that out of the way, here's the story. I was just playing Red Dead Redemption 2, and my mom came down to watch me play because that's her way of interacting with me. She kept asking questions about the story and stuff, and I'd tell her to listen to the characters and cutscenes but she wouldn't listen because she was just texting on her phone. Eventually, I was annoyed and said, ""Let's see what's keeping you busy."" I tried to grab the phone jokingly, but she got scared and pulled away, which got me interested. I left the room and five minutes later, I came back and took her phone right out of her hands while she wasn't looking, she started screaming and chasing me around. I tried to read but I couldn't read the texts, but I recognized the name(we'll call her V, who's a female). She was upset and left, and I figured something was up because if there was nothing to hide she wouldn't have acted this way. So I knew something was wrong. I acted distant the next few days because I was worried about what was wrong and that she was hiding stuff from me. A couple days past, and she sat me down before school, and asked me what I saw on her phone. Now since I didn't know any specifics, I didn't want her to know that so I just said, ""You tell me.""  That's when she basically said, ""You saw what I was talking to V about. How I like-like her.""  And guess what happened the next day. My dad told me he knew that I knew. WHICH MEANS HE KNOWS ABOUT THE AFFAIR!!!! He said  that he doesn't like it, but he has a couple reasons for tolerating it. 1.He still loves her, 2.He doesn't want to break the family up, and 3.She says she's ""exploring herself"" so he feels like it would be unfair to give her an ultimatum. I was pissed. My dad is sacrificing so much, including his self respect and happiness, and my moms sleeping around with her best friend. 

Now about two months have passed, and my dad is still unhappy, my mom still doing this, and she's barely at home anymore. She's at V's house 24/7 basically.(Another fun side note, V also has a husband and two kids, and her husband also knows and is also very sad and upset with this).

And the worst part is, my mom keeps making me and my dad hang out with V. She'll make us have dinner with her and her family, and it's so awkward and painful. I'm just really pissed off that my mom is just tearing apart my family and making us unhappy, just for her sake. 

For those of you that read this far, thank you for listening, and I hope you don't fuck up like I did.
Moral of the story is don't read other people's phones...

TLDR:I read my mom's phone, stumbled across her affair with her best friend, and my family's falling apart, yay!

EDIT:To the people(and I say people even though I only saw one guy say this) who are saying I'm an asshole for looking through my moms phone, yeah I fucked up, it's in the title, but I don't think it's all that fair to call me an asshole when looking at this entire situation.

EDIT: Also I'm stupid for not mentioning this earlier, but the affair has lasted longer than I've known about it, it started around last August, sorry I feel like that was something I should've mentioned",tifu
I think black americans need to stop complaining about slavery like it was personal,"It happened, it sucked, get over it. Every other race has both owned and been slaves at some point in time.

In the same time period, Asian and Irish semi-slaves toiled in mines and railways and to this day not a cent in reparations has been made. There are no memorials to these people who helped build an empire. History books barely mention them. Because the children of those who suffered didn't try to use the pain their parents and grandparents went through as a bargaining chip.",unpopularopinion
"TIL Lincoln was famous for his self-deprecating sense of humor. When accused of being two-faced, Lincoln replied, ""Honestly, if I were two-faced, would I be showing you this one?""",,todayilearned
Would it be possible to teach the entire navy seals copypasta to a parrot?,,NoStupidQuestions
Criticism of Islam is not Islamophobia.,Just because I don't like the religion doesn't mean I don't like Muslims (the people).,unpopularopinion
TIFU accidentally watching a Black Mirror Episode with Audio Description on,"Not today, but Black Mirror subpost about season 3 being the best was trending yestersay, and I just remembered my fuck up. 

Said episode was ""Shut up and Dance"", where the young protagonist was forced to rob a bank, fight other people, etc. Because an unknown person hacked into his computer and threatened to reveal his dark secrets if not complied. 

Now, I don't understand how, but for some reason, the audio description was turned on when the episode began. So the narrator describes the characters' actions inbetween dialogues like, ""Sister comes up and touches his hands"" and whatnot. 

Had it been any other shows or movies, my wife and I definitely would had caught this mistake instantly. But of course, the Black Mirror always fucks with our minds, so we just went with it and hypothesized what the voice could be, and what the episode was trying to tell us. 

I think we came up with some absurd ideas like episode is about how we don't really have free will, only chosen ones can hear this voice, the narrating voice is the hacker, etc. We were basically focused only on the voice in the sky the entire episode. 

Well, the end was near, and came the twist. Normally, we would have gasped at the revelation (more surprising because there were subtle hints throughout), but not this time. We were like yeah, yeah, that's cool, so what was the voice? And to our complete and utter shock, the episode was over without any explaination about the voice.

We were quite dumbfounded at this point, because as complex as Black Mirror episodes go, we could at least understand the basic message it was trying to tell us, but this time we couldn't grasp anything. After some thinking and talking, we cut our losses and just moved on to the next episode where we soon found we are too dumb for this show.  

Tl;dr turned on audio description, thought it was part of the show and got really confused.





Edit: mostly lurker, I don't know if there are any etiquettes I have to follow through, I will upvote everyone's comments for now.

For those who says it's not TIFU, I guess it's mundane, that's true. Since some folks are okay with the change of intensity? Of fuck up, and so are mods,  I am at peace with it.",tifu
