title,text,label
AITA for no longer wanting my trans cousin in my wedding party?,"Throwaway because my sister knows my Reddit. 

I'm getting married next year and I'm so excited about it. My fiancé has all his groomsmen picked out, and I'm in the process of asking my bridesmaids. I'd also have liked to include my twin cousins E and A in the bridal party, as we were always so close growing up. A is a guy and lives a few hours away. E is FTM, which I'm sad to say plays a major role in this AITA. 

I drove out two weeks ago to visit A and ask if he'd be willing to be a part of the bridal party. I put together a box of goodies, and a card that said ""Will you be a part of my Bride Tribe?"", deliberately not trying to use the word bridesmaid. He was excited and we talked a little bit about expectations/plans for how his and E's ties/pocket squares would match the bridesmaid dresses. I specifically asked him not to mention anything to E because I wanted it to be a surprise.

Fast forward to this weekend and I meet E for lunch. I give him the same little box of goodies with the same card. E's reaction didn't go as I expected. He got really angry, accusing me of wanting to ""fit him back into a feminine bridesmaid mold"" despite his transition. I tried to explain that I'd picture him and his brother wearing color coordinated suits, but I didn't get the chance because he kept talking over me. I feel like he went off the deep end. He called me bigoted, asked why I wanted him to support a wedding that would only end in a divorce, called me ""basic"" and adhering to stupid sexist traditions. He left without giving me a chance to really explain.

I guess today E finally calmed down and talked to his brother who must have explained because he sent me a text message apologizing and saying he'd be in the bridal party. I drafted a text message saying basically that while he's still invited to the wedding, given his feelings towards me, it's best if he isn't a part of the bridal party. My fiancé says I should do whatever makes me comfortable, but my mom seems to think I'm being to harsh on E and should have seen this misunderstanding coming. She says I should be more understanding, considering the abuse/discrimination he must face. She says I should give E a second chance and if I don't it will cause all kinds of family drama.

Would I be the asshole if I refuse to let him be a part of the wedding party?

ETA: 
Wow, I cannot believe how much this blew up. So I'm going to clarify a few things here in hopes that it addresses your questions.

E sent me a text apologizing. His apology was for ""snapping at me"". He admitted he was wrong and it was ""totally out of line"" and now that he talked to A he knows what I meant and would be in the wedding party ""if I'd have him"". Nothing specific was mentioned, and I haven't sent any response yet. 

A also did call me this evening, but I was out to dinner and missed his call. I called him back but right now we seem to be playing phone tag.

ALSO, E is a man. He uses the pronouns he/his/him. Just because he may have been an asshole/acted out of anger does not give ANYONE license to misgender him. If you want me to take you seriously, use the correct pronouns for E.",AmItheAsshole
Crazy Neighbor Claimed to Own My House [Update] [KY],"So a few days ago I made a post on here asking for some advice relating to a woman trying to say she owns my property and attempting to evict us. We have everything figured out now so I figured I'd post a small update.

Crazy Lady has not come back to our house or contacted us in any way. We spoke to city and county officials and have gotten proof of ownership of our property (including the fact that we paid our fucking property tax today) and are beginning to take steps to get a restraining order on the Crazy Lady. 

Thanks for everyone's advice and jokes that really helped when I was stressing out! You're pretty good when you're good, Reddit! ",legaladvice
"[Update] ""My work's fun committee ignored reasonable request, HR told me to pound sand.""","https://www.reddit.com/r/legaladvice/comments/8826mu/ny_my_works_fun_committee_ignored_reasonable/

(New York)

A lot has happened over the last ten days.

I realized, shortly after making my initial post that my life, as it is, has become unsustainable.  I cannot live like this anymore.  And I mean that literally, because this realization came to me just before i hurt myself very badly.

I was sitting in my bathtub and it suddenly struck me that I was completely prepared to just stop living because I was too scared to find help.  So I went and found help.  

I took all of last week off and with my ex-husband's help, I found a good, understanding and very very patient therapist.  I've also made an appointment to see a psychiatrist, to see what medication options are open to me.

When I finally went back to work, I took the head of the Fun Committee aside and talked to her.  I explained to her that I have PTSD and some very severe anxiety issues and I apologized for not being more clear to her when I asked her not to do anything for my birthday.

And she cried.  She wept openly and apologized, she told me she thought I was just shy, that she was just trying to help me fit in and she never intended to do anything hurtful to me.  

Then, I spoke to my Manager and my workspace is being moved to a far less-populated part of the building, where I can just quietly do my work and be left alone.  It is literally all I have ever wanted.

So, the moral of this story was, fucking talk to people about your shit before it gets so bad you feel like you have no choice but fucking die.  Apparently.

Thank you.",legaladvice
TIL That if My Name Is Earl had not been prematurely canceled the creator planned to end it with Earl being unable to finish his list but realizing that his original list had started a chain reaction of good in the world,,todayilearned
LPT: Crumple your aluminum foil for crispier frozen fries that are easier to flip.,"Crumpling the foil crinkles it, so it has less surface area to make contact with the fries.  This makes them stick less, crispier and less likely to be burnt.  Also works with taquitos, fishsticks and other types of lazyman's food.

Edit: jebus this blew up. From the comments:

Alright, it's aluminium... the one time autocorrect failed me.

No, were not frying the fries, nor using cooling racks!

It's been debunked, though I still notice a difference.

None of this matters because aluminum is toxic and parchment paper is better!

Edit 2: Front page while I was asleep.  (There's a lounge!)

Edit III: aluminum is right too.  We're good again, autocorrect.

",LifeProTips
"A mormon was having an affair with a 15 year old girl who had lied about her age, when he learned the truth he broke it off and over the next few week guilt set in and he confessed to his wife. She screamed at him,","""How could you cheat on me like that with an older woman!?!?!?"".",Jokes
"Trying my luck on this sub. ""My [37M] Son [21M] Slept With My Girlfriend [32], I Don't Know How To Process This Level Of Betrayal""","**Deleted off the other relationship sub, advised to repost here**

I apologize in advance if this isn't the most coherent thing in the world, this is partially just me venting to the void. About 4 years ago I lost my wife, the mother of my son, to lung cancer. We had been together since we were 14. It was the darkest time in my life, I had considered suicide on a nearly daily basis. I pushed on for my son, and because my wife made me promise to make the most of life.

We had our son pretty young, I worked two jobs to keep us afloat and thankfully was able to provide a decent upbringing until he moved out at 16, although I still paid (and continued to do so until this happened) a portion of his bills. The loss was extremely hard on my son as well, he came back to stay with me for awhile and we'd work through the grief together every day. I got him into therapy, pushed him to get involved in things to keep his mind busy and when he moved back into his apartment I'd call every night to check on him and visited multiple times a week. We were always extremely close.

My wife told me outright after her diagnosis that she didn't want me alone, so I made myself available. My girlfriend and I met about two years ago and hit it off. She isn't my wife, but I loved her for who she was and we really connected. I was reluctant to introduce her to my son because I was afraid he'd feel I was betraying his mother so I held off for the first year, which I regretted as they ended up getting along very well. We'd hang out together, my son was happy, I was happy. She moved in with me about 5 months ago.

This past Thursday he was over for dinner and movies. We've had this little game since he was a teenager where I'd pop up over his shoulder when he was on his phone in common areas and say ""stop looking at that!"" in an accusing way to mess with him even though he was never looking at anything. Turns out this time he was doing something and I seen topless photos on his phone. I recognized the photos to be of my girlfriend, same tattoo placement between the breasts. I grabbed the phone from him and he immediately starts pleading his case. I go into gallery and there are easily two dozen photos of my girlfriend, some of him I'm assuming he sent to her, one or two of them together. By this time he's crying and trying to grab the phone back, I check his texts and he has two weeks worth of conversations with her (under a different name) detailing the fact they've been fucking around behind my back. My girlfriend is in the room begging to know what's going on.

I'm not proud of the fact I lost myself. I screamed at them both, I smashed the phone (yes, I know this is unacceptable, yes I'm in therapy, yes it's the first time I got aggressive with either of them), I demanded details. My son kept apologizing and saying he didn't know why and that it had only started two weeks ago, they slept together 3 times. My girlfriend was sobbing and kept trying to hug me, telling me it was ""a mistake"", purely physical and that she'd never speak to him again. I screamed at my son that I'd given my life to him, that he knew what this meant to me, that he was all I had left. I pulled him upstairs and gave him the money for his phone and kicked him out. I went upstairs to our bedroom, turned her drawers upside down and packed her clothes into two travel bags while she kept asking me to listen. I put them outside, guided her through the door and told her she could have someone else get the rest of her belongings this week.

Both of them have been texting me nonstop until last night, at which point I blocked their number. I feel completely detached. The fact that after 2 years my girlfriend, knowing my history, could betray me is painful enough, and absolutely nothing will make me forgive her. She refuses to get her stuff until I talk to her so I'm having a friend drop it off to her. The fact my son, who I dropped everything for, worked non-stop to provide for, who was all I had left in this world could do this to me knowing what it would do is another pain entirely. It feels like I lost another family member. I ache for my wife all over again. I know everyone processes grief differently but this was two years after her passing, he had a girlfriend and I was there for him (as were therapists) every step of the way, so I have a hard time believing grief is the cause of his decision. I can't see this as a mistake, he didn't trip and fall. It was a conscious choice to betray someone who loved him.

I want to honor my wife by giving my son a chance, to hold on to the little family I have left. But this isn't like he stole money from me, it isn't even something that happened once while drunk. He was there for that grief with me, he knew how hard it was for me to move on. Of all the women, he chose mine. All the apologies or future effort can'r erase that fact or the memory of it. I never did wrong by him, and now I feel like the kid I raised isn't there anymore. Thanks to friends I'm not drifting into thoughts of self harm again, but I don't know if I have it in me to ever forgive him. If and when that day comes, what steps can I take to process what happened, talk to him without feeling disgust and open the door to trusting him again? And if that day never comes, does that make me a bad person?

**Edit** Some brief clarification since people on the other relationship sub took this and ran with it. 1.) Nothing caused him to move out, he asked and said it'd be cool and I helped pay his bills. No hidden resentment I've ever been aware of. 2.) Yes, popping up over his shoulder sometimes was something we both found funny. No I wasn't actually trying to invade his privacy, yes he was a part of the joke. 3.) Yes I know I was aggressive. I paid for the phone and will be discussing it in therapy. 4.) Yes I know this sounds like something out of a movie, it's not.

**TL;DR**: Lost my wife four years ago, just me and my son ever since. Found out he's sleeping with my girlfriend, feel completely empty inside. Need some sort of comfort or advice on how or if this can ever be fixed between him and I, and if that doesn't happen will I ever feel whole on my own again.",relationship_advice
A young man named Joe bought a horse from a farmer for £250.,"The farmer agreed to deliver the horse within the next few days. A couple of days later,  the farmer drove up to Joe's house and said, 'Sorry son, but I have some bad news, the horse died.'

Joe replied, 'Well, then just give me my money back.'

The farmer said, 'Can't do that. I've spent it already.'

Joe said, 'Ok, then, just bring me the dead horse.'

The farmer asked, 'What ya gonna do with it?

Joe said, 'I'm going to raffle him off.'

The farmer said, 'You can't flog a dead horse!'

Joe said, 'Sure I can, Watch me. I just won't tell anybody he's dead.'

A month Later, the farmer met up with Joe and asked, 'What happened with that dead horse?'

Joe said, 'I raffled him off. I sold 500 tickets at £5 apiece and made a profit of £2495.'

The farmer said, 'Didn't anyone complain?'

Joe said, 'Just the guy who won. So I gave him his £5 back.'",Jokes
What are some REALLY REALLY weird subreddits?,,AskReddit
"LPT: When you hear that someone has said something negative about your character, resist the temptation to disparage them, too. Instead, mention something you like about them. Keeping a cool head and refusing to descend into pettiness can discredit the other's unflattering remarks about you.",,LifeProTips
You need to earn 50k of upvotes in a 48hr period in order to save a SO who is kidnapped. How do you do it?,,AskReddit
AITA for moving forward with the pregnancy against the wishes of the bio father and his wife?,"I'm going to be real brief. I thought I was in a monogamous long-distance relationship with a man (management consultant) who travels to my city a lot for work. I found out he's actually married with several young children. He lied to me about his age (much older), his real name, and his relationship status. 

But I'm pregnant with his child. I am hiring an attorney to guide me through the child support process.

He is insistent that I have a termination because   he is not interested in supporting a child for 18 years. Out of no where, his wife contacts me this morning, very angry, threatening legal action if I didn't terminate. I get that she is upset with her husband, but I have no f-cking clue why she called me with threats and name calling. I don't even know how she found my number! I'm really upset right now but I feel like I have done nothing wrong with my decision to keep the pregnancy. 

I don't think she's the asshole because I get that she's upset. But I definitely don't think I am either!",AmItheAsshole
LPT: keep an extra set of clothes and essentials in your car.,"Keep a small tote with a few essentials in it in the trunk of my car for emergencies.

I keep:

An extra set of clothes (socks, shorts, cheap flipflops, sweatpants, shirt, sweatshirt, underwear, and a hat)

Insulated leather gloves

Flashlight (batteries not inside to prevent draining/corrosion)

Deoderant

Towel

Hand sanitizer

A deck of cards

Lighter

Small cheap pocket knife

Paracord

I can't even tell you how many times this has been a total lifesaver for me or others. Went hiking and your socks are soaked? put on some dry ones. Go on a road trip and forgot deoderant? Boom, no problem. Went fishing and someone fell in the water? They have dry clothes and you are their hero. 

The tote will be shockingly useful in a lot of surprising ways, too. One time someone hit my car, knocking my bumper half off. Luckily I had rope to tie it up and get it home. Another time I was drinking at a friends' and we all decided to go swimming. I got the gym shorts out of my car and didn't have to go swimming in my jeans/naked. I also had a towel to dry off with.

My tote is pretty small (14x10x10 or so) but has had a solution of most of the problems i've ran into. Everything is pretty cheap and well worth the time to put it together. Does anyone else do anything similar or keep other things in their trunk? (A small first aid kit is also great to have, but I keep that separately)

edit: Easier to read formatting

edit edit: Wow I can't believe the response! A couple of things from the comments: A lot of people have mentioned melting deoderant. Granted, I live in a colder climate (northern Michigan) but the Old Spice Pure Sport I have has been in my trunk for years and hasn't shown any sign of melting. Water is also a great thing to have, but be aware that in colder climates it might freeze! Water and deoderant are both items to have, but definitely tweak your list of supplies for whatever climate you live in.",LifeProTips
If you delete an old post do you still keep the Karma?,Edit (additional question): What if the post gets deleted by a mod? Do I keep it?,NoStupidQuestions
AITA For saying no when a child I didn't know asked if she could play with my sons bike.,"This is literally the hot topic of the day for my entire family and I'm fed up of being called an asshole so I'm going to ask on here. 

We are on a family vacation at the moment and we had gone to a park where there were a lot of young families like my own. My 4 year old son has a new bike that he loves to ride around on and there was another family close by us that had also settled for a picnic like we had on the grass. They were pretty close by. 

My son is obsessed with his bike and loves it. He had been playing on it for a while, and the other family had a little girl his age that kept looking over. 

When we sat down to eat my son sat with me, the little girl came over and shyly asked my mom if she could play with the bike. My mom always says yes to everything, and she has this really blasé attitude towards belongings and she's lost some of my sons stuff before that way because she just isn't attached to material things.

I interrupted before my mom could speak and really gently told the little girl 'why don't you ask (my son) since it's his bike?' She did and my son said no. She looked a little crestfallen but went back to her family and she didn't seem bothered afterwards. 

My entire family looked at my like I was an evil witch and even my own husbands facial expression was surprised at me. 

I got a little defensive and told them that it was our sons toy to lend out as he pleased, and I was a little irritated to hear my mom say to my son 'honey, sometimes it's nice to share' because he looked upset afterwards. l know that, he knows that, but it's his new toy and he shouldn't be made to feel bad over not wanting to share with a total stranger. 

AITA?",AmItheAsshole
"AITA for eating my all of wife's toblerone, then buying a new one?","Yesterday a mutual friend came over and gave her a gift of a Toblerone from his holiday in Switzerland. She agreed I could have some so I did. She's out for a for days and my temptation got the best of me, so I ate the rest of an almost full packet.

She has a habit of leaving food out to spoil, so I assumed it was all good to eat, but she sent me a message to make sure that there's some of the chocolate left for her. Fuck, it was already gone, so I've just rushed to the shop to get a new one in expectance that I'm a dead man when she gets back. 

She once flipped out at me for eating her year old decorative pasta, so I'm not taking chances.

Toblerone is replaced - with even more than there was previously. Not sure if I should put it in the Swiss packaging or apologize and just tell her that I bought I new one. For now I'm keeping quiet, like a parent discovering the dead goldfish and doing the ol' switcheroo. I'm in the UK btw, so the recipe is exactly the same as the one's in Switzerland.

AITA?

Also, she religiously reads this sub, so if she comes across this - G, I love you and I hope you forgive me like you did with the pasta.



Edit: she fuuucking saw the post and replied! but seriously, never again. ❤️

https://www.reddit.com/r/AmItheAsshole/comments/df8i1a/aita_for_eating_my_all_of_wifes_toblerone_then/f32i9g7?utm_medium=android_app&utm_source=share",AmItheAsshole
TIL A theme park in France employ ravens to clear the park off cigarette butts in return for a reward (bird food).,,todayilearned
