title,text,label
"UPDATE to ""He's(25) falling out of love and I(25f) don't know what to do"": Why he avoided me.","[Previous Post](https://www.reddit.com/r/relationship_advice/comments/b17a0h/hes25_falling_out_of_love_and_i25f_dont_know_what/)

What happened after I made the post: I wrote him a letter, hinting that this relationship won't work if it continues like this. I also printed the post I had made and the comments I got. I thought maybe it helps if he sees it from a different perspective. I put the letter and what I printed on the bed, together with a photo book of an amazing vacation we had. I then removed the SIM card from my phone, a), because I didn't want to communicate with him until he read what I had left on the bed, and b), because the phone was actually his old one as my actual phone had been sent in to be repaired, and had now arrived at my parents', and that's were I wanted to spend the weekend. Then I picked up all our pets, and left for my home town (I always take them with me when I visit my parents).

Apparently, he came home early from work, only about an hour after I had left, to a deserted apartment. When I put the SIM card back into the repaired phone about 7 hours later, he had left a few messages, saying that he had read what I had written and printed out, thought a lot about all this, he had looked through the photo book, and had a conversation with a friend. That friend is almost twice as old as we are, used to be his drinking buddy and is sort of a father figure for my boyfriend. He said that this friend had gone through the same situation with his wife. Apparently, he had been so stressed out by his job going downhill, he tried to safe it by working longer hours, which sometimes created some tension between his wife and him, so he avoided her by going out for drinks every night, creating a vicious cycle of her being unhappy about not seeing him and him avoiding her even more.

But he had found a solution. He realised that his job shouldn't define his life. He made a list of goals he wants to tick off each week. His marriage has apparently been going very well since then (it's the reason why I said he used to be my boyfriend's drinking buddy!).

My boyfriend said it dawned on him. He's in the same situation. He's putting in as much effort as the CEO who doesn't even appreciate his work. He doesn't want to lose me, I'm the best thing that has ever come to his life. He apparently cried a lot and made his own list of goals he wants to tick off each week. When I came back Sunday night, I found it on our fridge. It has very specific goals about him working less overtime and making up for the lost time by taking time off, spontanously going out only once a week max with his drinking buddies, and spending time with me doing real activities at least twice a week.

Since then, our dynamic has changed entirely. We had sex. We cuddled. We talked. He was there. Now it's only been 6 days since I made the post, but I hope it stays this great between us. I guess the realisations he had could help with him keeping up his new goal habits.

Weirdly, all the talks we had before when I told him I was unhappy because we didn't see each other much probably contributed to him avoiding me even more after already being stressed from work. This ""talk"" was different, because it made him realise that he'd lose me if it continued like this, and because it made him reach out to his friend. Maybe the deserted apartment contributed as well, because it was a little taste into life without me.

TL;DR: I probably owe my boyfriend's friend big time.",relationship_advice
What tastes so good you can't believe it's healthy?,,AskReddit
TIL that the final science exam for 8th grade students in Ketchikan Alaska is a 2 night survival trip on an uninhabited island.,,todayilearned
"Gordon Ramsay is invited to your house for dinner. Each piece of criticism he gives about the food awards you $1,000. What are you serving for dinner?",,AskReddit
[Update] I think my mom is going to try to kill my grandmother and make it look like suicide.,"I wanted to thank the r/legaladvice community and give an update to [my original post](https://www.reddit.com/r/legaladvice/comments/9sudc9/i_think_my_mom_is_going_to_try_to_kill_my/) from about 4 months ago. For privacy purposes as this is an ongoing situation, this post will be fairly short and vague.

Last month my grandmother was admitted to the ICU in respiratory failure. She pulled through, but with the help of my aunts, uncles and cousins we determined (with evidence) that my mom has been both neglecting my grandmother's medical needs and drugging my grandmother without her knowledge. Although she wouldn't outright say it to me, it turns out that my mother had been insisting to my cousins that my grandmother was suicidal, and even tried to keep pushing the 'she wants to kill herself' narrative while my grandmother was hospitalized. We believe that she may have even attempted to OD my grandmother at the hospital, but her plan was thwarted by ever-present relatives. As an aside, we did alert the hospital of the situation and unfortunately were told they couldn't do anything because ""it's a family matter"". Everything is now in the hands of my aunt, who's working with a lawyer to address the situation in the least stressful way for my grandmother. Thank you all for your advice and support on my last post, and I'm so glad that my grandmother is still with us. I truly believed that this situation would only end in tragedy, but it seems fate had different plans. My grandmother is still in the care of my mother for the moment (with relatives checking in daily), and while my mother is not yet aware that my family knows of *everything* she's been doing, she does at least know that her siblings are seeking to change the POA and insurance benefits out of her name, and has since completely changed her tune about my grandmother's mental health. Otherwise, my grandmother is home and doing well, and is under the close eye of her children, doctors and social worker while my family works out where to go from here. Thank you all again.  


Edit: Bot says I need to add location. All legal happenings are in NJ.",legaladvice
WIBTA for not wanting to feed my ex-wife?,"My ex and I have two boys (7 and 11) and we have 50-50 custody. Every Thursday she comes to my house to pick them up for her time. I noticed more and more food was gone, but not for sure. I was able to confirm that food was going missing because someone drank my last can of Ginger Ale. I asked my sons' sitter if he knew anything about it and he said my ex drank it. I was confused. Apparently, when my ex comes to pick up them up, she'll start making a snack for herself like she lives there. I thought about it and want it to stop.

The issue is that she is unemployed and has no money. I believe she is hungry. It's not about the money or cleaning up after yourself - it's about boundaries.

&#x200B;

EDIT - I do pay her child support, $300 a month. I make 90K a year and she makes 45K a year. However, I pay for the kids' tuition and cover their insurance. I believe that my ex is barely breaking even at the end of each month and lives paycheck-to-paycheck. She lost her job back in August and just found something in October so that fucked her finances up. 

That's not my problem though.  

My problem is that she just welcomes herself to my food. Literally, the stuff she eats is the food that I buy for myself. For example, my diet ginger ale. It pisses me off that I come home and want to have a nice cold ginger ale with my dinner only to find that the last few were drank. And when she uses a plate, she'll rinse it off but doesn't dry it or even put it in the fucking dish washer.",AmItheAsshole
"British people of Reddit, how is the American Revolution tought in your schools?",,AskReddit
Weird Al Yankovic deserves to be inducted to the Rock and Roll Hall of Fame,"The man is obviously musically gifted. He is a versatile talent who is able to parody **any** genre of music. 

His music has been relevant for almost 4 decades, and he continues to make hits - something that very, very few artists can claim. 

He is seen as a cultural icon, and beloved in the music community - a Weird Al parody is seen as a signifier of true Stardom within the community.

He is the single greatest artist in his genre, and has been for almost 40 years.",unpopularopinion
Wife asking me to get circumcised - advice?,"Hi guys!

My wife and I have been married 2 years, 4 together total.

I grew up in Europe and circumcision is extremely rare there. Apparently it is much more common in the US.

All her past BF were circumcised and she says she prefers it that way.

She stopped giving my oral sex once we got married and she says it's because she doesn't like doing it for me because of how I am not snipped.

She also calls it anteater penis and makes increasingly disgusted faces when we have sex.

I am willing to do this in order to make her happy but I just want to know you're all thoughts about this.

TL;DR: wife doesn't like my ""anteater"" dick as she calls it so she wants me to get circumcised.

**Thank you /u/kiringiraffe - your testimony sealed the deal for me. I will NOT be doing it!**",relationship_advice
"I use to be a foster kid, my adoptive mother keeps saying I can't legally leave when I'm 18 and she has rights over me till I'm 21. ( TL;DR)","I'm 15, and in dire need of leaving asap . I was planning on moving when I turn 18 ( though I'll still have a year of highschool to finish ). I will be a legal adult at 18 but my aunt ( who adopted me ) keeps saying that I 'Cant leave til I finish high school"" and ""DFS says I have full rights over you till your 21 "" this statement doesn't make sense and sounds like nonsense. I asked To see that on paper and she can't produce it . This is in Missouri . 

TL;DR: My adoptive mother is saying even though I'll be 18 that I still don't have legal rights over myself and can't leave , is this true for former foster kids in Missouri 

Edit: thanks for all the advice . I want to add that while I'm.not physically abused I am in a very toxic unhealthy situation that isn't a good environment for someone with the issues I have. Alongside that they won't accept the issues I had been medically diagnosed with and refuse to get me help. My family does get paid for me , I didn't know it was suppose to go towards medical / dental as we get all that for free due to medicare ? So I wonder where the money going lol. Thanks again

Edit 2: Thanks for the gold",legaladvice
LPT: Take the time to do a full clean of your vacuum. Wash everything and cut out all the hair from the roller. It will make a huge difference in the cleaning quality and will last you a life time.,Well guys... never thought my first front page post would be about a vacuum cleaner haha!,LifeProTips
"I fucking hate the ""incest-trend"" in porn.","Like, for real, does anybody actually enjoy it? I get that people get off on things ""taboo"", but there must be better way to achieve that than to imagine having sex with your sister/uncle/mom/grandpa etc.

Can't porn producers just be content with making people bang their bosses or best friends sister? And you can't even filter it out! Half-way through a decent POV-flick and suddenly the girl says something like ""Yeah, you like fucking your sister huh?"" and the whole thing is ruined. Instant boiled noodle.

I am in no way a prude, but damn it if I don't draw the line at ""Family Funtime"".",unpopularopinion
Women in one piece bathing suits are more attractive than bikinis,"A one piece bathing suit is more attractive, practical, and less exposing. Not that there is anything wrong with women wanting to expose and show off their bodies. As a man I find one pieces more attractive given that I find women attractive who dress more conservatively, elegant and don't want to stand out.",unpopularopinion
What helps you go to sleep when you don't feel tired?,,AskReddit
TIFU I said no to my Gf's proposal.,"WARNING: THIS IS A LONG ONE. SCROLL DOWN TO THE TL;DR IF YOU DON'T WANT THE FULL STORY. 

Yeah... I f***ed up today. See, I've been dating my GF (K) for 5 years. We are deeply in love, we have pets together, we live together, etc. I've wanted to propose to her for about 2 years. The reason I haven't is that about 2 years ago, I got diagnosed with a rare disease and have been on and off several medications and chemotherapy. 

It's been VERY rough on the two of us, but K has stuck with  me every step of the way. My disease, GPA, is chronic, deadly when left alone, and tough to beat in my particular case. I'm starting drugs that haven't been FDA approved for my condition. All other typical forms of treatment have failed and things are kinda bleak, but not terrible just yet. This new drug is promising, but hasn't been guaranteed to work. I'm terrified to say the least. All of this medical stuff has prevented me from being able to go outside, let alone commit to anything serious. 

I want to be healthy and stable before I even think about marriage. I don't want to leave K as a widow with no support! K & I had talked here and there about getting married, but had always come to the conclusion that I needed to go into remission first. We agreed to it, or so I thought. Flash foreword to a few hours ago and K is with MY FAMILY in a public restaurant, holding a ring and getting down on one knee. 

I saw my father, who has an extensive history of butting into my private affairs without asking to be involved, with his eyes wide and smiling. I immediately started freaking out. First thought: I haven't even gone into remission yet and I have no clue if I'm going to get better. I cannot get married and then hear that the drugs aren't working. What if I die from all of this? Second thought: GODDAMN IT DAD! Why do you always have to try and manipulate everything from behind the scenes?!

I guess I'm coming off as a bit of a brat here, but my Dad was a very involved parent when I was young. When I entered High-school, my father would play me up to college recruiters, my boss at the time, and to teachers. The expectations would get so high that I couldn't live up to them. Similar situations happened with friends and extended family as well. Both my brothers and I find this to be a real problem, if my Dad is left unchecked. I would go more in depth, but that is a post for another r/. Back to the story!

Anyway, I'm freaking out. I just start sputtering the first words that come out of my mouth. Sadly those words came out as a hodgepodge of ""no-nno waaay!"" With my heart beating out of my chest and a lump in my throat, I ran out of the building... I made the love of my life cry as I selfishly drove off and everyone in the restaurant dropped their jaws. I've never felt so ashamed in my life... After calming down, I talked to my Mother, and drove back to talk to K.

In the parking lot, without my family, we discussed what went down. Tears were shed and things were said. K told me I was being selfish. ""We've been dating for years, who cares if you die, I want to marry you!"" She also explained that the whole proposal was her idea, my dad had nothing to do with it. She understood why I would be paranoid about my dad though. K understands that my Dad has boundary issues and admitted that it would have been better if she didn't include them.

In the end, we reconciled. We made up, decided that I was being redicules and paranoid, and she wasn't forthcoming with her real feelings on marriage, engagement, and how my disease effects our relationship. We came to the conclusion that we should be engaged. We want to spend the rest of our lives together, no matter what the circumstances.

Now I'm engaged, still have no idea if my new drug is gonna save me, but if I do end up in an even worse place medically during it all, I'll be with my best friend/lover. K is my world, and I'm an idiot for ever considering not spending my life with her. 

Thanks for listening.



TL;DR
I said no when my GF proposed bc I'm on chemo and don't know if I'm gonna go into remission or die. Decided I was being stupid and reversed my idiotic decision to yes.

EDIT: Thank you so very much for the silver, gold and platinum!",tifu
What are some good first date questions to get to know someone?,,AskReddit
AITA for not going to bed at my Wife's bedtime?,"Both 25, married for a year.

Wife is a teacher and needs to be up at 5AM, I don't need to be up till 8AM. She goes to bed every night at 10PM and I grew up a night owl, I enjoy staying up late past that for alone time and to dork around on my PC.

I always go to bed with her because I love her and genuinely enjoy laying next to her and kissing her goodnight, but she has become increasingly aggressive and frustrated by me leaving around 10:30 to go into the other room. She doesn't want to be alone, but typically we spend every moment together from the moment I walk in the door after work.

I struggle with boundaries and I am a people pleaser, so right now we have this unhealthy dynamic where I wait for her to doze off and I sneak out and if she catches me I tell her that I'm going to go get some water or something. It is making everything worse and I feel like I am lying to her.

I need perspective on this. One of my first ever Reddit posts so forgive me for missing etiquette or formatting.

Thanks.

Edit- Thanks for all the comments, I genuinely appreciate it. Surprised how large this got.

I think the solution is to sit down at a time things are calm and have a conversation about my boundaries on this. I want to be there and enjoy that quality time while she relaxes and falls asleep, but she needs to understand that I would rather spend my day with her while she is awake and spend some alone time when she is already sleeping. It all seems so reasonable when its typed out here on reddit but in real life its too easy to get lost in an argument.",AmItheAsshole
I looked at the reddit history of someone who said something positive to one of my comments and noticed that they have a 4 year history of saying only positive and engaging things very regularly. Where do I go on reddit to commend this shining example of what a redditor should be?,"the person is u/JJPasadena and no it's not an alt account of mine or anything, I just randomly looked at this persons profile and was awestruck at how exceptionally positive a person can be even with anonymity and I want to know where the appropriate place on reddit is to celebrate someone like this especially with all the negativity going on in the world in general right now.

I hope u/jjPasadena knows they set off this chain of good feels today.  Thanks to everyone for the good comments",NoStupidQuestions
"If someone were to tattoo a baby completely head to toe with black ink and watch them grow, would the tattoo begin to ""crack"" as it grew up?","girl i'm seeing didn't think this was good pillow talk so she never answered me and figured you guys could give a crack at it.
 
has this been done? i'm curious as to where the new skin begins.",NoStupidQuestions
Why is it so hard for HR people to do the common courtesy of letting their applicants know that the position has been filled? Sending a quick email to all other rejected applicants seems like it should take no effort.,They could even automate that stuff at this point right?,NoStupidQuestions
TIFU by uploading my old exams on the internet.,"So this all happened in June, and I'm only writing about it now because the situation just got solved.

As the broke college student I am I found a website that offered me money for my notes about classes and old exams that I have taken, extremely simply procedure that consists of simply uploading PDFs on the web, categorizing them, and then getting a payment on my paypal. I think ""Great! I make money and I can help kids seeing what to expect on the exam by seeing the old ones"". 

The fact that I scanned all my exams and kept them in my Google Drive to have them as possible study material made the whole process easier. I upload 5 documents from my Organic Chemistry class and get paid $25, I figure that I might as well do it for all the classes, more money to buy alcohol you know?

In the span of a couple days I upload about 120 documents for subjects such as OChem, Physics, Calculus that span from old exams to notes to summaries about the whole class, pretty much my old study materials. I get a couple hundred bucks and go buy my, at the time, well deserved booze.

Fast forward a month, and I have just given all my finals, got my 4.0 this term and I am happily preparing to go back home. I wake up one morning with an email from my email professor informing me that due to the content I uploaded he is gonna fail me in the class even if I passed it with an A. 
I immediately panic, I start freaking out.
To make matters worse, I get an email from my Physics professor with the same exact content, failing the class even though I passed it.

Now I am actually freaking the fuck out, I am an international student in the US so now I'm scared my visa is gonna get cancelled and that I am a dead man.

Next day I receive an email from the Director of Student Affairs asking to meet me to discuss the question. I'm hoping he will just give me a slap on the wrist and tell me to not do it again. I meet him and after a two hour meeting he informs me that most likely I will be expelled from the school, not allowing me to enroll at the university I was transferring to and ultimately revoking my visa. I get home and have an absolute breakdown, I can't tell my parents because they will fucking disown me so I have this weight on my back that's literally killing me. 

However, the decision wasn't final so the Director asks to meet me again the next week. Every day that passes it becomes worse. I don't know what to do with myself. I have so much shit going one that I start having suicidal thoughts, I am at the lowest point of my life (I've been lucky enough to never have experienced any real problems).
The day comes and the fucking Director tells me that he will not give me a final decision today and that he will contact me via email, due to the fact that I am leaving to go back to my home country and won't be in the States to personally see him.

I fly back home, and after approximately three days I get an email informing me that I have been suspended for the summer term, I have a 2500 word paper about Academic Integrity and my GPA has been lowered to a 1.0 for the term. However, I will be able to transfer to the University I was planning to go and I will get to keep my academic scholarship. 
Additionally, I have to write a paper of 2500 words about academic integrity that includes interview to two professors along with some other assignments that will be communicated me later.

Fast forward a couple of months and I am currently on a plane flying towards my new college, with a hue weight off my shoulders.


tl;dr I uploaded old college exams on the internet, went from a 4.0 to a 1.0 for the term, nearly got expelled and deported. 

EDIT: I forgot to add that I had to remove all the documents I uploaded, only way to do so was refunding the company that paid me via PayPal. So overall, I didn't end up earning one cent.

EDIT 2: Holy fuck this blew up way more than I expected.

I've been getting a lot of mixed reactions, people feeling bad for what happened (which they shouldn't) and people ripping my asshole apart (rightfully so).

Just to specify a few things that I might have gone over too quickly. 
The exams were semester old exams/weeks old, as I wanted to make sure nobody could benefit from the uploads as they would have been required to already take it.
Secondly my GPA for the term was lowered to a 1.0, this impacted my overall GPA a tiny bit but I was still
able to secure an academic scholarship at the university I transferred to.

I didn't post it the TIFU with the purpose of saying ""Fuck my College they are a bunch of douchebags"", it was more with the intent to show how little, at the time meaningless, actions can fuck up your future, big time.
Especially because I just assumed I would be able to do in the US things that I used to do in high school back at home.

I am grateful to the school for the course of action they took, as I know that things could have been way way worse.

You live and you learn.
",tifu
LPT: How to mute the gas pump.,"If your gas pump has one of those screens that blares sports center at you, there's an unlabeled mute button [here](http://imgur.com/a/ouhSq).

EDIT: Thanks for the gold! I think I've stumbled into some kind of suppressed Jimmy Fallon hatred.",LifeProTips
TIL that Abraham Lincoln once gave a speech so enthralling that reporters in the audience stopped taking notes and now we don't know what he said.,,todayilearned
