title,text,label
Ketchup is fucking disgusting,"A proper hamburger or cheeseburger should never have ketchup. It dominates the flavor and all you taste is shit. If I want to get the tomato profile, I will put a fucking tomato on my burger and not some pasty, corn syrup, sugary sissy bullshit. Every burger place puts ketchup on the burger by default, so I have to always ask for no ketchup and have the chance of them fucking it up. You ketchup fuckers should have to ask for ketchup, not me.

Putting ketchup on steak should be a capital offense and you should be sent to a reeducation camp. 

It's fat dumb people sauce. Its the keystone or natty light of sauce. Its putrid odor is reminiscent of filthy hooker perspiration. You can literally judge a person by how much ketchup they consume. Ketchup kills more people in America then terrorism and drugs, yet we don't have a War on Tomatoes. The world would be better without ketchup.",unpopularopinion
AITA [25] for telling my sister [19] that being a stay at home mom isn't a career plan?,"My sister has never put much thought into how she's going to afford to be alive. She doesn't have ambition.  
 
Ever since she was little, when asked what she wants to be, she'd jokingly answer that her plan is to be a stay at home mom. She's still saying it, but now she isn't joking.  
 
She doesn't even have that much experience with kids! She's never baby sat. 
 
Recently she's been telling family members she's going to nursing school which is amazing! I wanted to talk to about it and praise her.
 
I visited home last weekend (she still lives with my parents) and asked her what her plans are — in a sisterly way not in a ""this is a setup to lecture you way"". She said she's been lying to the the family and that she plans to keep working her minimum wage job until she meets a man she wants to settle down with. From there the conversation went like this: 
 
Me (irritated): there are no Prince Charming in real life, Rosie 
 
Rosie (irritates): yea ... I know ... I'm not looking for a Prince Charming. I want to find a man to raise up.
 
Me: but you are. You want someone to come take over your life because you don't have the motivation to do better on your own. If your whole life's goal is to find a man to love you, it's going to push you into the arms of the wrong kind of man. Also, how are you gonna ""raise up"" a man if you can't even raise yourself up? Do you want to be like mom? 
 
Rosie: no! I'm not going to be like mom! I'm going to do it better! I saw what she did and now I can do better! 
 
Me: well do better but improving yourself before you get knocked up. You don't remember but from 8 until 13 I watched you and (brother) every night while mom partied until 3 because she got pregnant too early, didn't have time for herself, and resented us. That's going to be you.  
 
My sister was crying at this point said fuck you, and left. 
 
My dad overheard and said I was too rough and she didn't need to hear all that. 
 
I think I was justified. Sometimes you have to be mean to get things through a person's head. 
 
AITA?",AmItheAsshole
TIFU by accidentally posting a topless picture on social media.,"This actually happened today! I put my 16 month old to bed at about 7:45. At 8:45 I checked his video monitor and was surprised to see him wide awake. He was creepily staring into the camera with his eyes whited out by the night vision. I took a screen shot of the video and posted it to social media. I typically have the camera zoomed in so you only see his crib, but if you zoom out the rocking chair next to his crib is in frame as well. I just usually can't see it. This is relevant. 

Here is where I fucked up. The monitor detects crying and grabs a 5 second video when it is detected. These are located in a queue at the bottom of the screen with a thumbnail for the video. After a bit I get back on social media and happen to review my post. The thumbnails are visible in the screen shot and I'm very obviously topless and sitting in his rocking chair in the very first thumbnail  (just got out of the shower and hadn't put on clothes when he started crying) I have no clue if anyone caught it, but it was super easy and clear to see. I completely forgot that you can see more of his room than just his crib. My brain will now spiral out of control all night while I ponder who has seen my boobs tonight. 

TL;DR Posted a screen shot from my sons video monitor not realizing that you could see a clear thumbnail of another video where I am topless.",tifu
AITA for asking a fat lady to give up her seat to a late pregnant mother and her SO,"So I was on the bus yesterday and it was packed. But this lady was so big that none was able to sit next to her. Now I had a seat on the bus for a while but as a student I give up my seat to other people as thats my schools expectation. But the entire time i had been on the bus this lady had been sitting in a 2 person seat by herself. Now when I get on its already full with many people normally standing and it really got on my nerves that this lady had the audacity to take up 2 seats. But when a lady who was deep into her pregnancy and her SO got on the bus it really annoyed me. after 2 or o minutes and no one had offered them or her alone i worked up the strength to ask her if she would get up and give her seat to the couple.

&#x200B;

Thats where i stuffed up. So i asked her politely if she would give up her seat so the lady didn't have to suffer with the pregnancy as badly. (Something along the lines of ""Excuse me ma'm would you mind giving up your seat so the lady over there could sit down so its a less unpleasant experience for her, if you could i'm sure they would greatly appreciate it)

&#x200B;

Apparently this was super rude and she got really offended and started shouting that i was 'fatphobic' and rude and that she would report this slight to my schools headmaster and get me suspended or expelled.

&#x200B;

So reddit AITA.

&#x200B;

\[EDIT\]

\-ok then i'm an asshole it though what i was doing was good but it turns out she probably had justifiable reasons for the 2 seats.

&#x200B;

&#x200B;

\[EDIT 2\]\]

\- thx for silver kind anonymous redditor. ",AmItheAsshole
TIL That the world's oldest continuously running business is a hot springs hotel in Japan that's run since 705 A.D.,,todayilearned
"UPDATE: Un-permitted contractor next door did $5,000+ of damage to my home, contractor and homeowner won't pay or provide insurance information","Hi r/legaladvice. Just wanted to provide a ""thank you"" for all of the responses and an update on the situation detailed in my [original post](https://www.reddit.com/r/legaladvice/comments/atin99/unpermitted_contractor_next_door_did_5000_of/). Basically, I'm a homeowner in Philadelphia, PA, and a contractor working on my neighbor's house caused a leak that led to a lot of mold and water damage that needs to be repaired, and the contractor and homeowner have ghosted.

&#x200B;

Since so many people suggested we file a claim with our homeowner's insurance, I gave that a shot. However, according to the adjuster I spoke to about our claim, our policy apparently has an exclusion for ""faulty workmanship"". Even though it's completely insane, I was told that our insurance company would not cover the damage or provide any legal assistance because the damage was caused by someone doing work on the house next door. The adjuster told me this is a very common clause in insurance policies. Basically, all insurance companies are completely manned by psychopaths and capitalism is an endless nightmare that will surely swallow us all.

&#x200B;

So now it looks like I'm back to square one. The police have suggested that I try to find information about the contractor and homeowner through the Licensing and Inspection Department to pursue legal action, but previous attempts at that came up with basically zilch aside from a suggestion to hire a lawyer. So I guess I'll try and find a lawyer that will take this case, although my previous attempts to reach out to lawyers about this issue have not been promising at all.

&#x200B;

Going forward, are there any additional avenues I should pursue? My insurance company (Farmer's by the way. If you're thinking of going with them I might suggest drinking poison instead) is completely worthless. The two lawyers I've spoken to seem to have absolutely no interest in taking up a case, one of them specifically advised against hiring a lawyer because of the relatively low cost of the damage, the amount we'd owe in legal fees, and the fact that cases like this are rarely paid out even when they're successful.

&#x200B;

It's been a bleak couple of days, but thank you all for your responses earlier and wish me luck.

Edit: ...Uh, whoa. I'll be responding to pertinent comments as I'm able, but being a dude with a 9 month old, it might be pretty slow going. Thank you all so much for taking the time to respond, and a big thanks to the mods for removing the lock on this post!",legaladvice
"TIL Bhutan is the world's only carbon negative country. The constitution demands at least 60% of the country covered in forest, making it a sink of over four million tonnes of CO2 per year.",,todayilearned
Whats the strangest thing you found in your house/property after you bought it?,,AskReddit
People who smoke weed every day are clearly addicted.,"I hate when people say this like Weed isn't addictive bla bla just enoy that shit 420 lmao. No.

If you choose to smoke weed everyday and create a tolerance for yourself and creates a psyhical dependence, then YES you are an addict. No not a heroin addict, no no a drug addict - a pot addict.. 
So stop telling yourself and everyone else otherwise just to point out the fact that weed isn't physically addictive, you still create an serotonin-based and mental addiction.

And yes to everyone that loves to smoke weed out there and are negatively impacted by my post, I smoke weed myself ( a lot actually) but I just thought this wasn't talked as much about and it's a real big issue in todays society of taboos.",unpopularopinion
Redditors who clean up crime scenes - what's the most bizarre thing you've witnessed?,,AskReddit
V,"V

*Edit: seems like the ctrl key on my keyboard is not working

",Jokes
"TIL wife bought a scratch-off lottery ticket to prove a point to her husband that it was a waste of money, but it ended up winning her $1 million.",,todayilearned
What do hospitals do with amputated body parts?,"Do they just throw them in the rubbish, do they have some special system or something else?",NoStupidQuestions
"TIL in 1972 Canada had a contest to complete the saying ""As Canadian as..."". The winner was ""As Canadian as possible under the circumstances.""",,todayilearned
"TIL German animal protection law prohibits killing of vertebrates without proper reason. Because of this ruling, all German animal shelters are no-kill shelters.",,todayilearned
"Parents shouldn't teach their kids that boys can't hit girls because it's wrong but should teach them that hitting everyone is wrong and they should expect to be hit back if they ever do hit someone, regardless if they're a boy or girl","I've noticed parents telling their children that boys should never hit girls, ever. My parents told this to my younger siblings and this has actually turned my younger sister into a bully towards my brother because when my sister hits my brother she doesn't get in that much trouble but when my brother hits my sister back he's called a bully or a girl beater. 

These girls will then grow up to think that men can't hit women and think that they can just bully their boyfriends or husbands but now both men and women are agreeing that if a woman hits a man, he can hit her back, so these women could be in for a nasty surprise

I'm not saying every girl will grow up to be like this, just a small minority but I feel they still need to be taught that. 

And same for boys, boys should be taught that they shouldn't hit anyone without reason and to expect a hit back because if thought wrong, these boys may turn into bullies towards girls.

Edit; If a woman hits a man, the man should defend himself. Self defence is important but if the woman poses no real danger then he shouldn't hit back unless really necessary. He definetaley should try and restrain that woman though. 

Same if a smaller, weaker man hits a larger, stronger man. If that man poses no real danger then there should be no reason for the bigger guy to just destroy the weaker man.

This post is only to say that parents should teach their kids, especially girls but boys also that a man may hit back if they hit them. That way the girls may not grow up to hit men as if they know a man may hit them back, they'll be too scared to hit the man first. Men are also biligically stronger than women so if a man hits a woman hard enough, he can cause serious injury or death so teaching these girls this could potentially prevent these injuries or death",unpopularopinion
TIFU by seeing my mother's porn.,"My PC sits next to my Stepdad's laptop in the living room. My cat likes to jump on the keyboard or the laptop and lay on it. A moment ago, he jumped up onto the keys and the screen lit up showing me to opened photo gallery. I went over and was going to close the application and then shut down the laptop. I was greeted with three distinct photos.

&#x200B;

One- My mother and my stepdad in a threesome. The thing is, the person in the middle was my mother's best friend. I saw her eating out my own mother as my Stepdad drilled the other girl.

&#x200B;

Two- My mother sucking off my stepdad, In my dad's house. On the counter. Where I eat.

&#x200B;

Three- More tame, but my stepdad (who is bald) with a decent head of hair. I've never seen him with more than a little fuzz before.

&#x200B;

So I have to face them tomorrow with these images seared into my mind.

&#x200B;

TL;DR - Saw my mom's porn. Help me God.

Edit: My mother woke me up while I was operating on three hours of sleep and ho boy. My stepdad uses reddit. He found this. You fuckers brought me to the front page. This is my first time ever here and my lord, why this post? Thanks anyway, even though my life just got a lot worse, now I have 10k virtual clicks!

Edit 2: Not 30 seconds after posting this edit my mom said she looked at the computer and couldn't find these images, and then I got my first ever medal in this gold. Fuck the Internet Man :)",tifu
We should domesticate bears.,"I don't see why not? No more need for cars, because you could just ride your bear around town and look cool as fuck, while being environmentally conscious. No more need for guns, because who needs a gun when you have a 2000 pound bear guarding your home at night. No longer will your children lose toys, balls, etc. in trees, because your friendly household bear is great at climbing trees. There are literally thousands of problems that could be solved by domesticating bears, and every moment we don't we are just wasting time. 

Edit: for everyone saying that this is a popular opinion, it obviously isn't popular enough because I'm still not riding a bear to work tomorrow, damnit ",unpopularopinion
What is the best loophole that you've ever found?,,AskReddit
LPT: Addiction to anything is always fun at first and you will never see it until it's too late. Listen to what people around you say even if it's hard.,,LifeProTips
"Found Hidden Camera in AirBnb (Seattle, WA)","My bf and I are staying at an airbnb in Seattle, we're basically living in the bottom unit (basement) and the hosts are directly above us. Everything seemed fine. Last night I went to use the charging cube and cable they had in the kitchen, for some reason it wasn't charging my phone so I took a closer look at it and saw that it was blinking. We shined a flashlight on the cube and realize it was one of those hidden camera charging cubes. It was in the kitchen but pointed straight at the bathroom, which means it has footage of us undressing (completely naked) and walking into the bathroom to shower. 



The hosts never informed us about this and we are really uncomfortable with the fact that it has footage of us without our consent. We contacted Airbnb but they are not super helpful and now we are considering calling the police to file a report. Is it legal for us to take the files from the cube (direct USB connection)? 


update 1: We called the police non emergency line, they won't give us an ETA or when they are coming but we have to wait for them. We only have 2.5 hours left until we have to check out . . . so I guess we will sit tight until then

Update 2: the couple left and went somewhere while we waited for the police. The police eventually did show up, made a report, took the camera as evidence, and tried to get a hold of the couple but couldn't. All my messages between myself and the host were wiped from the Airbnb app, I did not screen shot them but have copies of what the host said in my email. We are going to Mt Rainier for the next two days so I will keep you guys posted after. 

Update 3: Airbnb messages are back and I have full access now, will screen shot and keep safe! Thanks for all the advice and support, I'm just glad the police came and took care of it from there. Will look into lawyers once I'm back. Entering mt rainier now, will update later. 

Update 4: the host has contacted me and apologized stating that they did not know it was a camera and that some other guest had left it behind, they seemed a little upset and offended we would accuse them of such things. I want to give him the benefit of the doubt and hope that what he said was true. Airbnb refunded me the entire stay without me even asking and have temporarily suspended the host. They are starting their investigation and will communicate with the police. The police are still trying to see if they can get data off the device and are still doing their investigation. So that's where I'm at, it'll probably be a while before anything happens so I will make a separate update post when everything is settled. Thanks for the support everyone, it's been pretty terrifying and now I'm paranoid at every place I stay but I'm trying my best to just think of it as an isolated incident! ",legaladvice
I found out the stray cat I adopted has a brother. If I also adopt his brother would my cat recognize him as his brother or just a food opponent?,,NoStupidQuestions
TIFU by making people think I'm in an incestuous relationship with my mother (NSFW),"So today my mother and I did our weekly shopping. I accompany her most weeks as it's usually the only time we get to spend each other at the moment with our schedules and everything else.

It began as a normal journey and everything was going absolutely fine until we reached the end of our list and began to unload everything onto the conveyor, we had everything we needed except some batteries that my mother had forgotten to write on the list and only just remembered as we were going through the checkouts. Not a problem though as they were on a stand at the end of an aisle. I offer to go and grab the batteries enthusiastically enough that I mishear when she tells me which type of battery she wants. 

I had heard the word Duracell but not the type, and so I don't go back and ask what she wants, I wait until I am by the battery display, turn around and see my mum on the other side of a busy crowd of people. It's Christmas so of course people are everywhere.

My mind goes completely fucking numb for some reason and my wires get seriously crossed before I open my mouth to shout out across the store ""Mum, what kind of Durex did we want again?!"" It didn't even register that I had confused Durex and Duracell until the many horrified looks piercing me like daggers, none sharper than my mother's who I'm still unsure what to say to at this time. 

TL;DR - I yelled across a busy supermarket to ask my mum which kind of durex we want instead of which type of Duracell we want and we  were looked at like freaks by everybody as we left.",tifu
Michigan. I was denied a restraining order because my abuser said I'm kinky and because of my sexual history.,"In October, in the process of getting out of an abusive relationship, I filed for a restraining order and filed a police report and gave evidence such as text messages in which my abuser admitted to doing it. I gave the same copies of texts to the police when I filed the police report.

At the protective order hearing, his defense was that it was consensual because I have a sexual history involving BDSM, and that I was simply trying to ""punish"" him. We did not have that kind of sexual relationship, and hearing the judge asking him questions about my sexual history was extremely upsetting. They were laughing and joking about how ""you'd think it would be the other way around"" that I was a more experienced submissive than my ex was an experienced Dominant. I brought a eyewitness but the judge did not want to hear from my witness at all. He said it sounded like a ""bad breakup"" and gave me a restraining order for a few weeks as a ""cooling off period.""

Today I found out that the prosecutor is charging him. I know that there is a higher burden of proof for criminal charges than there is for a restraining order, so surely I should have been granted an actual restraining order, right? I want to know if I have any recourse for how the judge acted during the restraining order hearing, because it definitely put me in danger, and I worry that others will be put in danger too. I don't care about trying to get money, I just really feel like this is not the series of events that should have occurred. Is there anything I can do?

Also, do I have to worry about my sexual history coming up in court? I'm really hoping the prosecutor won't allow it.",legaladvice
"TIL that diamond, despite being the hardest material known, will shatter if hit with a hammer. Hardness means resistance to scratching; toughness is a different property.",,todayilearned
"Why is Stephen Hawking alive if ASL, a disease he suffers from, is said to kill you within 3-5 years?","Edit: Oh. Oh no. OH NO. Guys I'm sorry

RIP Stephen Hawking

",NoStupidQuestions
Paid rent on time. Apt complex processed it late. Now being penalized.,"State of Virginia.

I'm asking for a friend who seems to not want to stand up for herself. She paid her rent on time, but the landlord didn't process the check until 4 days later. At that point, her rent would have been late. She received a letter stating that she was late. I'm not sure what the penalty is, if any.

Is this legal for an apartment complex to do?

Edit: She called and has the office for the complex checking on why she got a letter. Just the few responses from here provided me with some key questions to ask her. That prompted her to call them and say something. Thanks for your help guys.",legaladvice
"If you had the option to give up sleeping in exchange for never feeling tired again, would you do it? Why or why not?",,AskReddit
