text,label
"if I ask my pregnant wife to move out because she and her best friend decided to ""test"" my loyalty? My wife is pregnant with our daughter. Initially we were really happy and excited about it. But then, she starts acting like a nut job. She gets angry and irritated for small things, insults me when she doesn't like the food I make, starts acting insecure and accuses me of losing attraction for her.

For example, she wanted to eat chicken sandwiches for dinner last week. Well, I made chicken sandwiches. So she eats all the sandwiches, leaves me nothing and told me that they tasted like shit. I wasn't pissed because she left me nothing. But if she didn't like them, why did she have to eat everything? When I asked her this she told me that she was hungry. Ok fine. She does this every time. Eats everything I make and calls it shit. I don't argue with her because I work for more than 80 hours a week and I really want to have some peace when I'm home.

So, yesterday, a random girl starts at flirting with me after the gym and asked me if I wanted to meet up with her for some drinks. I rejected her and told her that I was married. And when I got home, my wife started to hug me and apologise. When I asked her what happened, she told me that her best friend suggested a test for my loyalty. So they asked a mutual friend to flirt with me and asked me out. And I passed. Yay!!. I'm really pissed. I'm done with her antics. if I ask her to move out?

Edit: I don't live in the USA. Please don't discuss legalities based on the laws there.",3
People who can speak multiple languages: what language do you think in? ,1
when Nintendo had a fall in revenue from the less successful Wii U its CEO cut his pay in half for 5 months rather than blame workers ,5
"I(22M) Recently discovered My Dad (50M) choose me over my former Stepmother and Half-sister(17F) 6 years ago. Don't know how to process this. I was sexually abused between the ages 9-13 by my stepfather. Both he and my mom will be behind bars for many years to come. When I was sent to live with my dad, I was broken. I barely spoke, didn't eat much if at all.  I wasn't mad or angry. I was null of any kind of emotion. Basically I was alive but wasn't living. I kept my interactions with everyone to the bare minimum. I was polite but didn't  go out of my way to make conversation with anyone. I was more social with my dad but I kept it to a bare minimum.  I had noting left to say to anyone. It took me 2 years for be me to be able to allow my dad to show any form of parental affection towards me. That's how withdrawn I had become.

Dad was my rock throughout the whole thing.  When I experienced night- terrors, I would wake up and either find my dad holding my hand or him holding me.  He drove me to all of my therapist appointments. He made sure I was eating properly. There were days, I would break down for no reason and he would just hold me and tell me that everything will be okay. He literally went above and beyond for me. I hated the city that were living in. Because  I had so many bad experiences there, it made living there miserable.

I was so passive, it was scary. My therapist had told my dad that I was stuck in the victim's cycle; I didn't know how to get out. Because of this, I was bullied quite a bit. By the time I was 15, I had been to 3 different schools. It got to the point, where my dad pulled me out of public school and enrolled me into online classes. I was always very studious and managed to maintain a 94% average overall but my life lacked any sort of direction. Noting would motivate me.

Looking back, Dad did spoil me but at the time I wasn't aware of it. I was so in my own body that I barley acknowledged my surroundings.   If I asked my dad for a new bed spread, I would get me new one plus new furniture. My phone of 5 years broke and dad got a new one plus a laptop. I was grateful and thanked him. I did share with my half-sister and step-sister at the time. Again I was being polite. I didn't have any form of relationship with my former step-mother, step-sister, or half-sister. I barely knew what it was like being a son at the time let alone being a brother.

By the time I was 16, Dad had approached me and told me that me and him are moving out. I didn't question it. He had asked me to pack my things and we moved into a rental. I didn't think it was any of my business so I didn't press the issue. A year later, Dad had divorced my stepmother. One of Dad's business acquaintances offered him a partnership in Boston and he took it. We moved and I felt I was ready start my senior year of high-school in a public school. That year was probably the best year of my life. I was coming out of my shell. There was no fear of being judged or being the odd man out. It was if I was like everyone else. I felt ""normal"". I became more social, made a lot of friends, got into sports, clubs, I was going out more. Us moving probably saved my life.

Because we had moved 9 hours away from my half-sister, she would only come visit us on long weekends, a month during summer break. There was always a form of tension between my dad and half-sister. You could just sense it. It got to the point where as she got older, she stopped coming entirely.

Me and Dad have always been close. When I had graduated from high-school and gave my valedictorian speech, I could see my dad crying in the crowd. I lived with my dad while I attended college ( I still do for the time being) . Ever since I was child, I always wanted to be a doctor. Well, I just finished my first year of medical school. Honestly, I feel like a normal young adult in society. I have a job, friends, a boyfriend whom I've been with for 4 years. I'm thriving in all aspects of my life.

Recently, I got FB message from my half-sister. She was apologizing a lot and I had no clue what she was talking about. Turns out, the reason why Dad and I moved out from my stepmother's home was because my half-sister told my stepmother what I was watching her change........... Yes. She told her mom that I was watching her change.. At the time, I was traumatized of sex. Heck I was terrified of any form of intimacy. The kid was envious of what Dad was doing for me. She was so envious that she tried to move me out. Well I guess her mom and my dad got into a big fight and I'm only going to assume that she did not want me in the house. Because we moved out, I think it's safe to assume my dad didn't believe it. How can someone be so cruel? What did I ever do to her? those were the questions that were racing through my head. I didn't even respond. More importantly, Dad never let this to get back to me. Chances are if I had heard about this when I was 16, that would have been the final nail in the coffin. It also explains the ""tension"" between my dad and half-sister.

This is a lot to take in and I have a new found of respect and love for my dad. He gave up this marriage for me so I could live a normal life.Dad is away on a  business trip and won't be back for a few more days. I'm missing him a lot lately.

Should I bring it up to him when he returns? Also would it be fair for me to just cut my half-sister out of my life entirely? At the same time it's  sad that their relationship is almost non-existent and I almost want to help.

Tl;dr: Dad choose me over my stepmother and half-sister after my half-sister told a very dangerous lie that could have potentially ruined my life. Dad kept it from me for 6 years. Should I bring up with him?

Edit: I wasn't expecting such a huge response. I just wanted to say thank you for all the feedback. It will take some time but I will read all of them or as much as I can. As I was going through the comments, I found a number of people questioning the integrity of this. This a part of my life. I don't normally like to talk about about this . Aside from myself, my dad, and close friends, not many people know about this. The fact the people are saying that it's fake.... I don't what to say. It's not my place to try and convince anyone. Believe  me, they're times I wish could convince myself  it's not real but that's not possible. When I wrote this, I wasn't thinking about syntax. It was more just getting this out. People questioning it's integrity based on grammatical errors. Forgive me but I wasn't in the mindset to re-read and go over it. 

As for how I became valedictorian and a number of people very curious; I did respond to it in the comments but I'll post it here too. 

""It was very unorthodox how I became valedictorian after attending a real HS for only a year. My overall average was the highest in my graduating class but because I was in online classes for my previous hears, I wasn't eligible at the time. I met with the grade coordinator and had inquired about my chances and her response was the same.

I broke down in front of the coordinator and I told her the truth. Being named valedictorian was something I always wanted. To be that would have been my first accomplishment that I would have achieved based on my own merit. Yes, their is also the likelihood of getting a free ride to colleges. It wasn't trying to be Valedictorian financial reasons. Money wasn't a problem (Dad did make a lot), it was more this being my first official achievement. This would have helped me self-worth as well.

The girl who was originally going to be valedictorian did meet with me and I told her the truth. She actually talked to the administration to let me valedictorian instead. It something I'll forever be grateful for. That's actually how me and her became friends."". Not many people would do that and in HS. 

I'll be posting again. I just need a few days.",8
I wish I could be ugly for one day. Being ugly every day sucks.,0
"for having an Almanac? A bit of backstory. I met my wife in the summer of 2008. She was working as the ice cream girl at a local restaurant. I had gone to pick up some boxes because I was moving. Out walked my Sara...it was close to the end of her shift. And working in this particular restaurant was a...dirty job to say the least. (Seriously, I don't care what DDD says, that place is gross.) She was covered in sweat from cleaning the machines, caked in all the dirt from that nasty little kitchen, had a grease stain on her cheek...and she was fucking beautiful. Her smile, her easy laugh, her obvious intelligence...I'm pretty sure I fell in love right then and there that wonderful May night. (inb4 ""tHAts sO OlD faShIOned!!!"" Don't care. When you know, you know.) I wasted no time in asking her out and we hit it off immediately.
It started after our first date. She had mentioned she loves lilacs. Me, being a 23 year old guy at the time, didn't know Jack or shit about flowers. But the way she talked about how much she loved them I knew I didn't want to forget that tidbit of information. So I wrote it down in one of those mini spiral notebooks. (Think what cops use to take notes.) This was The Almanacs genesis. Over the years I've written down information about my wife. Her favorite color, her favorite restaurants, her favorite books, movies she wants to see, etc. Basically all the little things I knew I would forget. Anything that struck me as worthy of remembering when she told me. I would go through it every once in a while so I could do something sweet for her. Fast forward to yesterday morning.
I get a call from her around 11am. ""What the fuck is The Almanac?"" (The Almanac is written on the cover. It's just a silly name that occurred to me a few years ago.) She obviously has it, and I don't lie to my wife, so I tell her. She gets really quiet for maybe half a minute and then says ""I always thought you remembered this stuff..."" tells me she has to run and hangs up. I get home from work last night and she's really dejected. I asked her what's wrong and she says the Almanac has cheapened every sweet thing I've ever done for her. She called it my ""playbook"" and said she felt betrayed. Mind you I've never showed it to a single soul nor have I even told anyone about it. Until yesterday I was the only person in the world to know of it's existence. (She also said she hasn't decided if I can have it back or not, and that she's thinking about destroying it.) I'm kind of heart broken. I feel like this should be an example of how much I love her. I'm terrified she's going to burn it. I WANT to remember all these details that make my wife who she is. That's why I write them down. I don't chronicle these things for brownie points or status. I do it because I love my wife. I hear so many wives bitch that their husbands don't remember shit, and I don't want to be that guy. So yeah, I took notes. And now I'm getting the silent treatment. Or at best single word answers.
here?",3
What exists for the sole purpose of pissing people off? ,1
"by tricking my hospitalized brother into thinking the world ended Obligatory wasn't today, this happened a couple months back. My brother and I have always had a long-standing agreement that in the event of hospitalization, the other one would try to convince the hospitalized - by any means necessary - that the world ended (coming from the idea of waking up from a coma to find out you slept through the apocalypse, etc). This agreement was about 14/15 years ago, but we reference it quite often, so I was convinced he still remembered.

A couple months back, my brother was admitted to the hospital initially for intense stomach pains but eventually found what my dad describes as ""an absolute fuck ton of kidney stones"". Eventually he got out, but the stents he had to pull through his urethra snapped, and he was admitted again. I got home this time because my mom made it sound far worse than it actually was. I decided to take this opportunity to enact our agreement. 

Near the hospital is a really run down quarry-looking place. There's a bunch of rusted old metal shit everywhere, and a really ominous little cement shack which, to this day, no one in town really knows what it's for. So I went out and filmed a video basically along the lines of ""brother's name, if you're watching this, I'm already dead. Everyone on the world pretty much is. It's been about eight months since you went to hospital name. You need to head for the safe haven in Helsinki (we live in western Canada) - mom might be there. God speed."" I managed to sync it up to the TV and woke him up as it was starting.

This is where it all goes to complete shit. My brother began to lose it immediately. He started freaking out, screaming, basically got up, put on his clothes, and noped out into the hallway. I grabbed him to calm him down, which he eventually did. Nurses came in and I was ejected from the hospital for causing a disturbance (rightfully so).

He got out a couple days later, and we've been laughing about it ever since. My mom won't talk to me and told me to just fuck off back home. My dad thinks it's funny but won't laugh about it in front of my mom. I'm no longer welcome at a hospital unless it's an emergency. I've also been kicked out of a family vacation.

Worth the wait though.

tl;dr: Convinced my hospitalized brother the world ended via video, pissed off my mom and got banned from a hospital

EDIT: Wow this blew up?! I don't have a ton of time but:

1) I don't want to upload the video. I made it sound tamer than it was, I look, sound, and say completely batshit stuff on this video and definitely don't want to be associated with it xD

2) The TVs in the hospital had HDMI ports. I just plugged it into my Chromebook. 

3) I can see why people say I made this up for karma, but I didn't create a throwaway to do that.  If I cared that much, I would've posted it on my main account.

4) My mom has a genetic tendency to overreact. She hasn't been happy with me moving (western Canada to the maritimes, bitching about abandoning the family, etc), so this was probably going to happen regardless. She paid for it though and can't get a refund for my ticket so it's not my problem.",4
"a man falsely imprisoned for 10 years spent most of his time at the library to study law and prove his innocence, and then became a lawyer to help free other people who have been falsely convicted. ",5
Does anyone else put ornaments on the back of the tree because they feel bad that it doesn't have ornaments? ,7
"by not openning a gift for 1.5 years This actually happened some time ago but thinking about it is still quite painful.. I was in uni and made friend with this really cute girl in my senior year at an event. We got on well and I was really thinking about asking her out, but since this happened quite close to graduation and she might be going back to her home country I decided to keep in all inside and not doing anything. I thought that asking her to stay just 3 months after us knowing each other is too big of a favor to ask, so I kept it strictly friend between us so that out farewell would not be too painful.

In the graduation she decided to give me a gift of homemade chocolate in a very nice box that she made herself. It was all a blur but I kinda recalled her asking me to open it at home and let her know what I think. Well it was a very emotional moment for me and it is kinda her farewell gift to me so idiot me decided NOT to open it and kept it in the fridge (it was a very nice box that she made herself too so that is another reason). We met again after a few days at her farewell party, there were some emotional moment but I was prepared and considered that was it.

The box stayed in my fridge for I dont know how long, maybe 1.5-2 years? She went home and after a year dated somebody else and got married, and I also met somebody else. One day I was cleaning the fridge and saw the box again and decided that maybe it is time to throw it away. Chocolate has probably gone bad but curiously I still decided to open it, and my heart shrunk then I saw a full page note from her. She basically poured her heart out and said how much feeling she had for me, and wondering if something could happened between us.

I just felt so bad afterwards but decided to just keep it to myself. I probably looked like an asshole for how I acted when I last saw her, but she seems very much happy now and so am I..

TL;DR: Got a gift from a girl I really liked but decided not to open it after 1.5 years, totally ignoring her note for me hidden inside.",4
"Did anything ever come of the alleged pedophile ring that Jeffrey Epstein was involved in, or is that just done now that he's dead? ",7
"A father buys a lie detector that slaps people when they lie. He decided to test it out at dinner one night. The father asks his son what he did that afternoon. The son replies ""I just did some homework."" The robot slaps the son. The son then says ""Okay, okay. I was at my friends house watching a movie.""

Dad asks ""What movie were you watching?"" The son replies ""Finding Nemo"". The robot slaps the son. He then says ""Okay, okay. We were watching porn.""

Dad said ""What?! At your age I didn't know what porn was."" The robot slaps the father. 

Mom laughs and says ""Wow. He certainly is your son.""

The robot slaps the mother. 



^Edit: ^Fixed ^grammar ^+ ^tenses. ",0
"Minor Daughter Refuses Abortion. TW: Sex, Minor

&#x200B;

Throwaway for obvious reasons. I'm still shook and my boyfriend and I have been freaking out since we found out. I'm at the end of my rope and don't know what to do.

Our daughter is 11 years old. We found out she was pregnant. She had always been close with a boy from our neighborhood, he's 13. We never thought anything of it as we'd known him and his family for several years since we moved here.

It was clear she had a crush on him, but I never thought anything of it. Until she started complaining about things, I'd rather not go in to detail in, that were very familiar to me from when I had been pregnant. 

I didn't jump to the conclusion, but I did ask in to what they do when they hang out. 

They'd been having sex. God knows he knew about that stuff already but it had been going on for some time. I won't go in to details. Because I never wanted to imagine them myself. 

We had the birds and the bees talk, so she knew where babies came from. My boyfriend was fuming after I told him, and went straight to talk to the parents.

They knew as much as we did of the whole thing. They were as shocked as we were. We've already talked together, and they agree we need to terminate the pregnancy, for many reasons.

But she keeps saying she wants a baby. And I just don't fucking know what to do. I tried to explain all the issues you deal with when pregnant,  I was trying to be level headed. But she didn't seem to understand at all. We've scheduled several visits to the clinic already. 

What can I do? Is the boy, or his parents liable? What can a doctor do? Can the pregnancy be ended without her consent, if she wasn't able to consent in the first place?  
I'm at such a fucking loss. My world is crumbling.   
We live in Minnesota, if state laws matter.",2
I applied to be a sperm donor and the nurse asked if I could masturbate in the cup... I told her i'm pretty good but I don't think i'm ready to compete in a tournament yet.,0
"UPDATE: My friend is about to ask his girlfriend to marry him, but I'm the only one who knows how unfaithful she is. Do I say anything? Original post is here(https://www.reddit.com/r/relationship_advice/comments/bicdpm/my_friend_is_about_to_ask_his_girlfriend_to_marry/?utm_source=share&utm_medium=ios_app)

So I got lots of feedback on what to do here. A good majority of the commenters told me to say something. To clarify, it may not have been clear in the op but I was never planning on doing nothing. Of course you gotta tell your bro if they're being cheated on. I just was not sure how to approach the situation. 

Some of the commenters gave me some very helpful advice. Some of you told me to talk to the girlfriend first, some of you told me to wait, some told me to gather a bunch of evidence first which I ended up getting from Alison, the third party friend. Some of you guys got angry with me for not telling him sooner, told me I was a bad friend. Some were sure he wouldn't believe me, some predicted the gf would deny it all. Well all of you were somewhat right. Here's how it went down: 

I messaged Alison early on in the day, shortly after I made the post because typing it all out brought my guilt and apprehension from the situation to the surface. I said to Alison that I needed to tell Aaron, and asked whether or not she had proof. This was when she sent me the screenshots of the text messages. 

Aaron came over at around 8, and what was great was that Alison came over too. We all sat down and talked for a bit, and we all told him our suspicions about Mary. Alison showed him the text screenshots of Mary talking to her ex, and also told Aaron all the stories she shared about her sexual encounters. 

What was the most surprising was his reaction. He took it very well. He first got very quiet, and just nodded. Aaron ended up telling us that he had a sneaking suspicion that something was going on. He was not aware of the hookups, but he and Mary had gotten into fights before over the fact that she doesn't allow him near any other girls, but she goes out and flirts with other guys all the time. He told us that she had been distant lately, and would leave rather often without telling him where she was going. There were a few other small things he mentioned that told us he was just generally unhappy with his relationship. He knew in his gut something was wrong, but wanted to believe it wasn't true. 

We started unwinding with some alcohol after that and it all got way more emotional. He cried, talking about how he felt stupid for not seeing it sooner, how he really loved her and would've given her anything. Then he got angry. At her, and even more so at the guy. Some unpleasant and derogatory terms were used to describe her. 

Ultimately he told us that he's going to be breaking it off at least for now. We told him a million times how much better he deserved. He's definitely not going to marry her. 

Thanks again all for the supportive words and advice. We saved a good man from heartbreak!

Edit: Jesus Christ this exploded fast. Thanks for all the kind words people ðŸ˜…",8
"when the Nazis burned Sigmund Freud's books he said, ""What progress we are making. In the Middle Ages they would have burned me. Now, they are content with burning my books."" ",5
