text,label
"by putting a 5 hour energy in my vagina 12 hours before my first ""grown up job"" interview, i was sent a drug test permission form which stated it was to be done on company's grounds. considering i smoke weed daily i started looking up ways to pass a drug test. i came to the conclusion that i was going to need some clean pee, a small container, and a way to keep it body temperature. i had clean pee and an off brand 5 hour energy bottle (they're just a tad wider) but needed temperature strips to monitor the temperature. 

unfortunately i was unable to obtain any temperature strips in the time i had to prepare, but knowing that i wouldn't be able to pass if the temperature wasn't correct i had the idea to stick it up my vagina. i tested it the night before and even tied a string to it so i could pull it out with ease and everything worked great.

fast forward to the interview.
it was an hour and a half away so i decided to wait till i got there to insert it. i did it in my car w some coconut oil before i walked in just incase they decided to drug test me first. i walked in and everything was fine, i signed in and they told me to take a seat. as soon as i sat down i knew something was wrong. i went to the bathroom to make sure i could still take it out. i began pulling on the strings but the bottle didn't move. i tugged again and the string broke. at this point i'm freaking out. i try getting it out with my fingers but i can't reach it. the only ""tools"" i have on me are a mechanical pencil and a pen. so in a 3 piece suit and heels, i squat and begin to use these ""tools"" to try and remove the bottle. about 4 min go by and i'm really freaking out but need to go back incase they called my name. i walk out and the hr rep sees me and asks if i'm okay. i tell her i have a tampon stuck up my vagina that i can't get out and that's why i'm freaking out. she then takes me to the nurse and tells me that hey she can remove it for me! not wanting the target nurse to pull a bottle of pee out of me, i ask her if i can just try again myself, she says sure and hands me tweezers. obviously that didn't work. so she then gives me these scissors with a hook at the end and a disinfectant wipe... still didn't work. at this point i just have to do the interview. it lasted 3 hours and i had to take a tour of a 900,000 sq ft distribution center. 

when the interview finally ends i rush to the closest urgent care where i have to explain to the doctors why there's a 5 hour energy in my vagina. at this point i'm convinced i just don't have the right tools and they'll get it out in no time. upon looking, the doctor informs me that not only is it lodged behind my pelvic bone, but that it's also sideways. her first idea is to drill a hole into the bottle in my vagina and then fish it out. ~luckily~ they just sent me to the er instead. 

so now i'm at the er where they then inform me that since it's behind my pelvic bone getting it out would mean essentially birthing a 5 hour energy bottle, but since i wasn't actually giving birth my body wasn't dilated and they couldn't remove the bottle without putting me under.  

well, after 8 hours of having a 5 hour energy bottle lodged in my person, it was finally removed.
i didn't get the job and i didn't even get drug tested. 

tldr: tried to pass a drug test by sticking a 5 hour energy bottle filled w clean pee in my vagina. after 8 hours, an urgent care visit, and a trip to the er it was finally removed

edit: this isn't made up. idk if i have all the ""anatomy"" right i guess? yes it was very painful. yes, i have pictures and medical paperwork for people who don't believe me

i'm just telling you guys what the doctors told me. they might have just told me a dumbed down version without the right medicinal terminology, idk


i'm at work rn so this is all the proof i have for the moment lol 

https://www.reddit.com/r/gif/comments/bbd2n7/some_proof/?utm_source=share&utm_medium=ios_app

pt 2

https://www.reddit.com/r/whatcouldgowrong/comments/bbdzwe/some_proof_pt_2/?utm_source=share&utm_medium=ios_app

deleted proof 3 bc i was getting a lot of harassment. i still don't think a doctors name is confidential but whatever",4
that reindeer are the only mammals that can see ultraviolet light. this means that they can easily tell the difference between white fur and snow because white fur has much higher contrast. it helps them discover predators early in snowy landscapes. ,5
right from *now* your need for sleep is gone. you can now stay awake till your eventual death without any consequences. how would the extra time (that you get from not sleeping) affect your life? ,1
i finally got someone to be my valentine! i wish i could post this in any other sub.,0
"being proud of your race is lame because you had no choice of which race you are. people should be proud of their individual accomplishments instead of whatever they got at birth. my first assumption when someone is proud of their race is that they haven't done anything with their life so they have to latch onto the success of other people who look like them.

edit: a couple of comments have suggested that this means you also shouldn't be proud of your family. that doesn't apply because you had a direct impact on your family as they did with you. this extends to your community. what i am speaking of is hundreds of generations before you. 

another point i'd like to make is if you agree that people shouldn't be ashamed of what their ancestors did then by symmetry they shouldn't be proud either. current mongols don't need to feel ashamed of ghengis khan. i don't think modern germans should be held responsible for hitler. that also means they shouldn't get credit for the great things their ancestors have done either.

edit2: because there is some confusion, i'm not white. i actually made this post with white nationalism and stefan molyneux in mind. this logic should still apply to any race, gene, or whatever pre birth lottery you won/lost",6
a japanese company has awarded its non-smoking employees 6 extra vacation days to compensate for the smoker's smoke breaks ,5
frank zappa was a futurist who was enthusiastic for the possibility of holographic imagery. so much so that he recorded footage of himself in the early 70s with the intention to be used when technology got to that point. a frank zappa holographic tour using that footage starts next year. ,5
that the cdc has urged that schools open later because two-thirds of teenagers suffer chronic sleep deprivation. ,5
"just like ""don't shop, adopt!"" movement for animals, there should be a huge movement of ""don't reproduce, adopt"". i feel we already have enough population. and it's not doing any good! like lets be practical here. more than 70% of the world is struggling to meet their basic needs. 

i'm sure our dna is not that amazing that we need to preserve and pass on from generation to generation. it's not like if you don't pass on your genetics, world will loose something valuable. (grammar)

not reproducing but adopting can bring a huge change in this world! 

edit1: well this went out of proportion. rip my inbox. 

some clarification about my opinion. no i am not saying 'the first world countries should adopt kids from third world countries'

geez stop assuming that your country have figured out all the shit already. and now you have no problems and are left with helping the third world countries. so stop saying, hey i'm from norway and i don't want to adopt an african child. your country have zero orphanage?
it's funny how most of you guys assumed that you have to adopt a kid from african countries.

no i'm not pro 'let's adopt and help the third world'
i'm pro ""can't feed em, don't breed em""! 
but if you have money to raise a child, try adopting one, it'll make you happy and you'll be giving a child probably a new beautiful life.

and someone said the adoption cost is ~30,000$ like wtf!
your country needs to figure out some shit for that man. this cost is an average cost to raise a child for 10 years fulfilling his basic needs and school fees in my country man! 

edit 2: getting a tons messages from the  people who were adopted. 
you guys are amazing, yes some of the replies on this post are harsh. but a lot of them are positive as well. we can always look on the brighter side. love and respect to your parents who loved you and raised you like their own.
keep them stories coming, i'll reply to everyone of you!



",6
"a magical pet store is open, but the good pets are too expensive, what magical pets you find in the discount section? ",1
"update overheard my girlfriend say she would leave me for someone taller original post(https://www.reddit.com/r/relationship_advice/comments/cvz1jc/overheard_my_girlfriend_say_she_would_leave_me/)

so i read all the comments on my last post and even after breaking up with my girlfriend, i was doubting if i made the right decesion. i wasn't going to update because i didn't see a reason to do it, but after the the last couple days i came to a final conclusion.i want to clarify that i broke up with my girlfriend because of how easy it was for her to disrespect me behind my back, not because of the actual height difference.

after i broke up with her she continued to apologize to me. she would send me letters and call me a lot. in one of the texts i actually responded to, she asked if we could meet up and talk. without going into to much detail, she wanted a second chance and overall sounded very remorseful. i was about to agree, but something she said made me realize i would be making a mistake if i did. she said, ""i'll remember to respect from now on."" that sentence made me realize that i made the right choice by breaking up. since when do you have to be reminded to have the bare minimum of respect for your partner?

either way i'm glad i didn't give her a second chance. i don't know if any of you care at this point, but there's the update.

on a sidenote, the other day i was hanging out with one of my female friends who happens to be taller and i guess she saw us and started texting me that ""she doesn't need me,"" started saying that my friend was a pig and that i moved on to fast. blocked her and had a laugh i know for a fact i made the right choice.",8
"a bartender tipped himself $5,000 on my debit card and my local police told me i'm not allow to press charges as long as they're willing to give it back. basically a bartender gave himself a nice tip on my debit card after only spending about $30 on a few drinks. my account didn't have that much money, but since it was put through as a tip the original charge of $30 which went through changed to $5,041.75, which put my account at negative a couple thousand.


i went down to the police station, which is located right down the road, and explained my story to the cop so he can file a report. he said he's known the owner for years and was gonna go down there and sort it out. i get a call a couple hours later that he's willing to refund the $5000, but i said i still wanted to press charges. the officer said i literally can't ""as long as the other party is willing to make good.""

so i'm wondering here that how the fuck can someone try to rob you of 5k but its totally cool that once he's caught that he's sorry and will give it back?

i was refunded the 5k to my account, but now i have a shit load of overdraft fees because i use paypal to pay for my recurring payments (phone, spotify, hbo, etc.) every time paypal attempts to charge me, my bank tacks on another $35 overdraft fee. i've already been to the bank and opened the fraud dispute, but i only received a letter saying it'll take 60 days. i do not drive and i'm dependent on uber/lyft to get to work and i can't use that with a negative balance and my phone is about to be shut off because of this. every time i check my account, it's just further in the negative and i don't know what to do.

edit: the bot asked me to include a location so uhhh i guess jersey? kinda don't wanna get more specific than that.",2
"that people who experience goosebumps or ""shivers"" from listening to music tend to experience much stronger emotions in response to music and are more emotional in general. music tends to be a much more important part of daily life for these people. ",5
"new york - i've been visited by cps 8 times, to enquire about a child i don't have. at what point it becomes harassment or stalking? there's a cps agent that seems to be convinced that i have a child and i'm locking the child in my home. first time i was visited, i was very understanding. i allowed her to search my house without any restrictions. everything seemed fine. obviously no child and no evidence of one, because i don't have a child.

this was repeated 4 times in about 2 months by the same agent, until i stopped cooperating. i told her that from now on the only way i'm going to allow access to my property will be with a search warrant. a few weeks later, she came with a police officer, without a search warrant. the officer told me that it will be a lot easier if i allowed them to look at my house, i allowed the officer to do that by himself. again, no child was found. his search was very thorough, looking for hidden basements or doors in walls or something like that. 

two more times she has visited me to talk about my child and these times i have refused to talk to her. once, as i left home to go to work she was there to ask me questions. it definitely looked like she was waiting right outside my house to get a hold of me. i called the police but it went nowhere. i have called the cps office in my area 4 times to file a complaint but they go nowhere. this last incident happened this last thursday.

this woman has contacted my neighbors, my brother and sister, my coworkers and my employer already. everyone has told her that i don't have a child. 

this definitely seems like a personal obsession on the part of the agent. if this was a legitimate cps operation with reasonable evidence for what they're claiming, i'm sure they could get warrants after all this time and even put me under surveillance i guess? but they've made no efforts to do anything as far as my complaints have gone. so maybe her superiors are in on it, or at least don't care at all.

this is really going too far and is affecting my life. i actually fear for my safety now. i will install security cameras this week and will call the police if i found her waiting around my house but they don't seem to care because she's with the cps.

do i have a legal recourse here? like filing a restraining order against the cps (or against her), or maybe informing some different authorities to press charges for stalking? this definitely seems like it, at least in the layman's definition of the term. not sure how stalking is defined legally. what's the best way to stop her? 

location: buffalo, ny",2
"by losing a butt plug nsfw this happened about 20 min ago.

so last night my girlfriend and i decided to go out to the bars. got very drunk and stumbled back to my place and starting doing the deed. recently, we decided to be adventurous and invested in some butt plugs for her. well last night was the first time we decided to use them. we read online that using lube makes putting the plugs in easier, so that we did. everything went well but afterwards we couldn't find the plug. this is where the begins. 

we figured the butt plug must have just fallen out or something so we went to sleep and we would find it in the morning. woke up hungover and went to get food, entirely forgetting about the plug. gfs stomach has been hurting so we just figured she's a little extra hungover no big deal. we arrive at mcds to get some greasy hangover food. i order while gf heads to the bathroom to hopefully resolve her stomach issue. as i take our order back to our table, gf walks over in a panic saying we need to leave now.

she found the butt plug. in our drunken state, we managed to put the entire thing in her ass. handle and all. and now it's sitting at the bottom of a mcdonalds toilet in all its glory. 

tl;dr: did not use a butt plug as directed.",4
"how many geese would you need for a goosedrawn carriage? like those old horsedrawn carriages but with geese.

edit: my first 1k post thank you all!

edit2: just woke up to 9k and silver and gold! thank you all for your generosity!",7
does anyone else ever feel their mobile phone vibrate in their pocket when it's not in there? such as when you're holding it for example.,7
chocolate is now illegal. what's its street name? ,1
"ernest hemingway had often complained the fbi was tracking him, but was dismissed by friends and family as paranoid. years after his death released fbi files showed he had been on heavy surveillance, with the fbi following him and bugging his phones for nearly the final 20 years of his life ",5
"after ""the world's largest beach clean-up"" at mumbai's versova beach, olive ridley turtles returned to lay eggs for the first time in 20 years. ",5
"that in 1983 the head of a woman was found in a peat bog in england. a man assumed it belonged to his wife, who he had murdered and dumped in the bog in 1961, and made a full confession. the remains were dated and discovered to be 1750 years old. the man was still convicted of his wife's murder. ",5
"by fingering a girl obligatory this happened yesterday. this girl and i had a fun filled day out on the town. afterwards we got a hotel. things started getting hot and heavy and my fingers ended up in her pants. one thing led to another and i started fingering her. she was having a grand old time showing the usual signs that i was doing a decent job. a good portion of the way through my nails must have given her a bit of a cut and she said ou.... and passed out cold. i'm sitting her wondering what the fuck just happened. i call her name and start panicingly shaking her. she's not responsive and i slap her face. as soon as i did this she starts having a seizure. now i'm freaking the out. i jump out of bed and start to call an ambulance. i'm about to start the call and when she stops and starts making grunting noises. she's giving me this wtf just happened look and i tell her what happened. at first she tells me she doesn't believe me but then said that she has a history of having seizures when she gets hurt or scared. she said that when she has a seizure it's best to let it take its course unless it goes on for a while. i just sat there in that ""thank god i didn't finger a girl to death"" state. needless to say our sexy time ended right there.

tldr: i fingered a girl into a seizure. she stops and says it happens sometimes.",4
"by leaving thc chocolate out and sending my mom into orbit on edibles my cousin decided it would be a good idea to give my dad two squares of thc chocolate for christmas, because he'd mentioned that maaaaaybe he'd want to get high. my parents are 75-year old republicans. that was a big maybe.

&#x200b;

well, my mom is like an unsupervised puppy when it comes to chocolate. you put half a candy bar down and yoink, gone when you come back.

&#x200b;

you can guess what happened. my mom went sniffing for some chocolate and found it, and ate both squares of chocolate (\~8-16 doses, depending on one's tolerance) and got so high that she couldn't move or talk. her last words, high as a kite, were ""i think this might be the end?"" before my dad, fearing she'd had a stroke, called an ambulance.

&#x200b;

they took her to the hospital and when she came around a bit, the doc asked her what she'd eaten and she said, just two squares of chocolate. at which point i assume my father facepalmed and my parents had to tell the doc that my mother was in fact, simply higher than the redbull orbit jumper.

&#x200b;

anyway they ran every test in the world on her and found out she had major blockages in three coronary arteries, 97%, 98% and 99%. so now she's having a triple bypass tomorrow.

&#x200b;

tl;dr - mom got high as balls by accident, turned out it saved her life.

&#x200b;

obligatory gold edit: thanks all for your well wishes! ! a few things to clear up - mom went into the hospital on saturday. as of now, she's been transferred to a hospital in manhattan where she awaits surgery details. i'm in canada for work, so it's kind of tough not being able to hold my mom's hand, but i'm planning to head back down to ny this weekend to be with her. also....op is not a dude. :)

second update from my dad: mom's surgery may be thursday, with the holidays and all. i decided not to mention that i put the story on the internet.

fp edit - thank you so much for your kind words, shared stories, kind offers, and encouragement. i'm headed back to the states on thursday, the tentative surgery date. will post an update and see if my mom will let me take a selfie of the two of us.

update - mom ended up having a quadruple bypass and is recovering nicely. thanks to everyone who checked in, offered help, and got a laugh out of the story. all of the staff at the hospital knew about it and they thought it was hilariously serendipitous.

check out my adorable mom

&#x200b;

http://imgur.com/gallery/0bmg2ii(http://imgur.com/gallery/0bmg2ii)",4
